,종목명,날짜,제목,본문,SN_caller,SL_caller,NNP_caller,NNG_caller,SF_caller,SS_caller,SW_caller,SP_caller,NR_caller,NNB_caller,JKB_caller,JX_caller,XSN_caller,JC_caller,JKO_caller,MAG_caller,JKG_caller,VV_caller,EC_caller,XSV_caller,EP_caller,MAJ_caller,ETM_caller,XPN_caller,MM_caller,JKS_caller,VCP_caller,VA_caller,NA_caller,XR_caller,ETN_caller,XSA_caller,SO_caller,NP_caller,EF_caller,VX_caller,VCN_caller,SH_caller,IC_caller,JKV_caller,SN_other,SL_other,NNP_other,NNG_other,SF_other,SS_other,SW_other,SP_other,NR_other,NNB_other,JKB_other,JX_other,XSN_other,JC_other,JKO_other,MAG_other,JKG_other,VV_other,EC_other,XSV_other,EP_other,MAJ_other,ETM_other,XPN_other,MM_other,JKS_other,VCP_other,VA_other,NA_other,XR_other,ETN_other,XSA_other,SO_other,NP_other,EF_other,VX_other,VCN_other,SH_other,IC_other,JKV_other,stock_name,price,price + 30days
2514,나노신소재,24.07.25,"투자의견 매수, 목표주가 13.5만원으로 커버리지 개시","목표주가 13.5만원으로 나노신소재의 커버리지를 개시한다. 2025년 및 2026년 평균 예상 EPS 3,541원에 Target P/E 38배를 적용하여 목표주가를 산출하였다. Target P/E 38배는 19년부터 21년 하이니켈 양극재 침투율 본격화 구간에서의 글로벌 양극재 선발업체(에코프로비엠, 유미코아, 엘앤에프)의 12개월 선행 평균 P/E 값이다. CNT도전재의 고성장 구간 진입 시점이기에 유사한 흐름일 것으로 판단한다.",9.0,6.0,11.0,14.0,7.0,0.0,0.0,1.0,3.0,4.0,6.0,4.0,0.0,0.0,2.0,0.0,0.0,2.0,3.0,1.0,0.0,0.0,0.0,2.0,1.0,0.0,0.0,0.0,2.0,0.0,0.0,0.0,0.0,0.0,0.0,0.0,0.0,0.0,0.0,0.0,9.0,6.0,11.0,14.0,7.0,0.0,0.0,1.0,3.0,4.0,6.0,4.0,0.0,0.0,2.0,0.0,0.0,2.0,3.0,1.0,0.0,0.0,0.0,2.0,1.0,0.0,0.0,0.0,2.0,0.0,0.0,0.0,0.0,0.0,0.0,0.0,0.0,0.0,0.0,0.0,나노신소재,나노신소재에 해당하는 종목이 없습니다,나노신소재에 해당하는 종목이 없습니다
2515,제이오,24.07.25,투자포인트 1. 원재료 및 공정 내재화를 통한 원가경쟁력 확보,"1) 원재료, 2) 공정 내재화 및 효율화를 통해 원가경쟁력 우위를 지속할 것으로 판단한다. 매출 원가에서 촉매제, 에틸란가스, 그리고 전력비가 차지하는 비중은 약 30% 정도로 낮다. 이에 따라, 저렴한 원재료 수급을 통해 제이오의 마진은 지속적으로 개선될 것으로 판단한다. 공정 내재화를 통해 원가경재력 우위를 지속할 것으로 판단한다. 탄소나노튜브 생산설비 자체 증설을 통해 투자비용을 절감할 수 있어 상대적으로 경제적인 투자가 가능하다.",9.0,3.0,13.0,46.0,1.0,8.0,1.0,1.0,0.0,0.0,4.0,3.0,3.0,1.0,1.0,0.0,1.0,1.0,1.0,4.0,1.0,1.0,5.0,0.0,0.0,2.0,0.0,1.0,0.0,2.0,1.0,1.0,0.0,0.0,0.0,0.0,0.0,0.0,0.0,0.0,9.0,3.0,13.0,46.0,1.0,8.0,1.0,1.0,0.0,0.0,4.0,3.0,3.0,1.0,1.0,0.0,1.0,1.0,1.0,4.0,1.0,1.0,5.0,0.0,0.0,2.0,0.0,1.0,0.0,2.0,1.0,1.0,0.0,0.0,0.0,0.0,0.0,0.0,0.0,0.0,제이오,제이오에 해당하는 종목이 없습니다,제이오에 해당하는 종목이 없습니다
2516,대주전자재료,24.07.25,"투자의견 매수, 목표주가 15만원으로 커버리지 개시","대주전자재료에 대한 투자의견 매수, 목표주가 15만원으로 커버리지를 개시한다. 2025년 및 2026년 평균 EPS 3,953원에 Target P/E 38.2배를 적용하여 목표주가를 산출하였다. Target P/E 38배는 대주전자재료의 21년 상반기 12개월 선행 P/E 값이다. 21년 상반기부터 매출 비중 더블디짓(20년 8% → 21년 11%)으로 확대되기 시작하였으며 동시에 매출 성장률도 +62% YoY로 본격적으로 확대된 구간이다. 실리콘음극재 고성장 구간에 진입 전망에 따라 동사는 수혜를 볼 것으로 예상한다.",24.0,14.0,22.0,47.0,3.0,15.0,2.0,11.0,0.0,6.0,8.0,3.0,5.0,0.0,0.0,1.0,1.0,7.0,5.0,4.0,1.0,0.0,9.0,1.0,0.0,0.0,0.0,1.0,0.0,3.0,0.0,1.0,3.0,1.0,0.0,0.0,0.0,0.0,0.0,0.0,24.0,14.0,22.0,47.0,3.0,15.0,2.0,11.0,0.0,6.0,8.0,3.0,5.0,0.0,0.0,1.0,1.0,7.0,5.0,4.0,1.0,0.0,9.0,1.0,0.0,0.0,0.0,1.0,0.0,3.0,0.0,1.0,3.0,1.0,0.0,0.0,0.0,0.0,0.0,0.0,대주전자재료,대주전자재료에 해당하는 종목이 없습니다,대주전자재료에 해당하는 종목이 없습니다
2517,SGC에너지,24.07.24,2Q Review: REC 재정산 효과 크게 반영,"2분기는 매출액 6,068억원(-24.7% YoY)과 영업이익 680억원(+2,1460.0% YoY)을 시현했다. 발전/에너지 부문이 전사 실적을 견인했으며 매출액은 전년 동기 대비 11% 늘어난 2,491억원, 영업이익은 동기간 484% 증가한 623억원을 기록했다. 증기/전기/REC를 판매하는 발전/에너지 사업은 2분기에 REC가격 상승에 따른 차익분 약 300억원이 더해지면서 좋았다. 이를 제외하면 영업이익은 323억원인데 주 원료인 유연탄 가격 안정화에 따른 원가개선으로 15%의 영업이익률을 보여주었다. 건설도 지난해 4분기 적자에서 벗어나면서 분기별 20억원 내외 이익을 내면서 매출 증가와 함께 서서히 개선되고 있다.",10.0,6.0,6.0,9.0,2.0,8.0,6.0,5.0,2.0,1.0,1.0,2.0,1.0,0.0,0.0,0.0,0.0,0.0,1.0,2.0,1.0,0.0,1.0,0.0,0.0,0.0,0.0,0.0,0.0,0.0,0.0,0.0,0.0,0.0,1.0,0.0,0.0,0.0,0.0,0.0,10.0,6.0,6.0,9.0,2.0,8.0,6.0,5.0,2.0,1.0,1.0,2.0,1.0,0.0,0.0,0.0,0.0,0.0,1.0,2.0,1.0,0.0,1.0,0.0,0.0,0.0,0.0,0.0,0.0,0.0,0.0,0.0,0.0,0.0,1.0,0.0,0.0,0.0,0.0,0.0,SGC에너지,28950,25450
2520,KB금융,24.07.24,2Q24 순이익 1.73조원(+15.6% YoY)로 어닝 서프라이즈,"2Q24 지배주주 순이익은 1.73조원(+15.6% YoY)로 시장 기대치를 +17.5% 상회하는 실적을 기록했다. 원화 대출 성장은 +2.3% QoQ로 가계 대출 +2.6% QoQ, 기업 대출은 +2.0% QoQ 증가했다. 그룹과 은행 NIM은 각각 -3bp QoQ 하락했다. 비이자이익은 전분기 대비 -1.4% QoQ 감소했다. 특히 기타영업손익이 +19.5% QoQ 증가하였는데 주로 유가증권, 파생, 외화환산 및 보험금융 손익이 +15.5% QoQ 개선됨에 기인한다.",18.0,2.0,18.0,41.0,8.0,8.0,3.0,9.0,4.0,7.0,8.0,6.0,2.0,1.0,2.0,1.0,1.0,1.0,2.0,7.0,6.0,1.0,2.0,0.0,3.0,4.0,0.0,0.0,0.0,1.0,0.0,1.0,0.0,0.0,5.0,0.0,0.0,0.0,0.0,0.0,18.0,2.0,18.0,41.0,8.0,8.0,3.0,9.0,4.0,7.0,8.0,6.0,2.0,1.0,2.0,1.0,1.0,1.0,2.0,7.0,6.0,1.0,2.0,0.0,3.0,4.0,0.0,0.0,0.0,1.0,0.0,1.0,0.0,0.0,5.0,0.0,0.0,0.0,0.0,0.0,KB금융,93500,91500
2529,GST,24.07.24,기업개요,"GST는 2001년 설립된 반도체장비 제조업체로 2006년 상장. 반도체 및 디스플레이 제조 공정 등에서 1)스크러버: 사용후 배출되는 유해가스를 정화하는 가스정화장비와 2)칠러: 공정 중 발생하는 열을 흡수하여 챔버의 온도를 일정하게 유지시키는 장치를 주요 사업으로 영위하고 있으며 고객사 다변화 및 내부 점유율 확대와 제품 다변화를 통한 성장을 지속. 2023년 기준 매출비중은 스크러버 63%, 칠러 18%, 용역 및 기타 19%. 주가추이는 그동안 실적과 반도체 업황에 가장 밀접한 연동을 보였으나 2024년 초부터 AI산업 성장에 따른 액침냉각장비 기술이 부각되며 급격한 주가 상승을 보였다가 최근 조정기를 지나는 중.",37.0,11.0,36.0,51.0,19.0,14.0,17.0,14.0,12.0,14.0,10.0,10.0,3.0,2.0,3.0,2.0,1.0,8.0,4.0,8.0,6.0,1.0,8.0,2.0,2.0,2.0,3.0,2.0,2.0,1.0,0.0,1.0,0.0,0.0,10.0,0.0,0.0,0.0,0.0,0.0,37.0,11.0,36.0,51.0,19.0,14.0,17.0,14.0,12.0,14.0,10.0,10.0,3.0,2.0,3.0,2.0,1.0,8.0,4.0,8.0,6.0,1.0,8.0,2.0,2.0,2.0,3.0,2.0,2.0,1.0,0.0,1.0,0.0,0.0,10.0,0.0,0.0,0.0,0.0,0.0,GST,GST에 해당하는 종목이 없습니다,GST에 해당하는 종목이 없습니다
2530,KB금융,24.07.24,"2024년 2분기 연결순이익 1조7,324억원, QoQ 65.1%↑, YoY 15.6%↑","KB금융의 2024년 2분기 당기순이익(연결, 지배기업지분기준) 1조7,324억원으로 전분기 및 전년동기대비 각각 65.1%, 15.6% 증가했으며, 교보증권 예상을 20.6% 상회함. 이익이 증가한 이유는 견조한 순이자이익 증가와 전분기 ELS관련 손실보상비용 발생에 따른 기저효과가 있었고, 비은행 계열사의 실적이 확대되었기 때문. 이를 감안하더라도 교보증권 및 시장 컨센서스를 상회하는 실적 시현은 고무적임. KB금융의 2024년 2분기 순이자이익은 3조2,062억원으로 전분기 및 전년동기대비 각각 1.7%, 6.5% 증가함. 2분기 그룹 NIM 및 은행 NIM은 각각 2.08%, 1.84%로 전분기대비 3bp씩 하락했으나, 저원가성예금 증대를 통한 조달비용 축소와 운용자산 수익률 제고 노력ㅇ로 전년동기에 비해서는 3bp씩 상승세 시현함. 2024년 2분기 순수수료수익은 9,197억원으로 전분기 및 전년동기대비 각각 7.1%, 3.3% 감소했으나, 경상적인 수준을 시현한 것으로 판단됨. 그룹판관비는 1조5,939억원으로 전분기대비 2.1% 감소했으며, 전년동기와는 비슷한 수준임. 그룹 비용효율성(CIR)은 35.8%, 상반기 누적기준 36.4%로 5년간 지속적인 개선세를 기록함. 2024년 2분기 신용손실충당금전입액은 5,526억원으로 전분기대비 29.0% 증가했으나, 전년동기대비 15.2% 감소함. 이에 대손충당금전입비율(CCR)은 그룹 기준 0.43%을 시현했고, 상반기 누적기준 그룹 CCR 및 은행 CCR은 각각 0.40%, 0.10% 안정적인 수준을 유지하고 있는 것으로 판단됨. 2024년 6월말 그룹 BIS비율은 16.63%, CET1비율은 13.59%로 전분기대비 7bp, 11bp 개선되었는데, 환율 상승에 따른 외화관련 위험가준자산 증가에도 불구하고 순이익 증가 및 자본관리 노력이 결실을 맺은 것으로 사료됨.",8.0,6.0,10.0,41.0,6.0,7.0,3.0,5.0,2.0,5.0,4.0,5.0,1.0,2.0,1.0,1.0,3.0,1.0,5.0,10.0,6.0,0.0,5.0,0.0,2.0,6.0,1.0,2.0,0.0,1.0,1.0,0.0,0.0,0.0,6.0,2.0,0.0,0.0,0.0,0.0,8.0,6.0,10.0,41.0,6.0,7.0,3.0,5.0,2.0,5.0,4.0,5.0,1.0,2.0,1.0,1.0,3.0,1.0,5.0,10.0,6.0,0.0,5.0,0.0,2.0,6.0,1.0,2.0,0.0,1.0,1.0,0.0,0.0,0.0,6.0,2.0,0.0,0.0,0.0,0.0,KB금융,93500,91500
2539,네오위즈,24.07.24,균형잡힌 포트폴리오와 우수한 개발력 보유,"네오위즈는 모바일 및 PC 웹보드 게임 ‘피망’, PC/콘솔 기반의 ‘P의 거짓’(소울라이크 액션’, ‘DJMAX RESPECT’(리듬), 모바일 기반의 ‘고양이와 스프’(힐링 시뮬레이션), ‘브라운더스트 2’(어드벤처&전략 RPG) 등 균형잡힌 포트폴리오를 갖추고 있음. 해외 매출 비중은 2022년 32.7%에서 2023년 ‘브라운더스트2’ 및 ‘P의 거짓’의 글로벌 흥행에 따라 40.8%로 상승. 1Q24도 41.0% 기록. ‘P의 거짓’을 개발한 Round 8 스튜디오는 1) P의 거짓 DLC(2H24 출시 예상), 2) P의 거짓 차기작 및 3) 서바이벌 액션 어드벤처, 4) 역사 스토리 기반 RPG, 5) ARPG 슈터, 6) 시뮬레이션 장르 PC/콘솔 개발(라인업 변동 가능)을 통해 글로벌 성장을 지속할 준비를 하고 있음. 2024년 매출 3,667억원(Yoy +0.3%), 영업이익 333억원(YoY +5.5%) 전망. ‘피망’, ‘브라운더스트2’, ‘고양이와 스프’ 등 기존작들의 매출이 소폭 하향에도 견조한 흐름을 보이고, 하반기에는 3Q24 ‘영웅전설: 가가브 트릴로지’(수집형 RPG), 4Q24 ‘P의 거짓’ DLC 출시가 일부 기여할 것으로 전망. 연간 마케팅비는 매출 대비 10.9% 수준, 인건비도 YoY +3.5% 증가에 그칠 것으로 전망.",23.0,11.0,39.0,72.0,10.0,12.0,6.0,11.0,6.0,12.0,8.0,7.0,5.0,1.0,9.0,5.0,3.0,8.0,7.0,12.0,7.0,11.0,10.0,1.0,0.0,3.0,3.0,0.0,0.0,0.0,0.0,0.0,0.0,0.0,6.0,0.0,0.0,0.0,0.0,0.0,23.0,11.0,39.0,72.0,10.0,12.0,6.0,11.0,6.0,12.0,8.0,7.0,5.0,1.0,9.0,5.0,3.0,8.0,7.0,12.0,7.0,11.0,10.0,1.0,0.0,3.0,3.0,0.0,0.0,0.0,0.0,0.0,0.0,0.0,6.0,0.0,0.0,0.0,0.0,0.0,네오위즈,네오위즈에 해당하는 종목이 없습니다,네오위즈에 해당하는 종목이 없습니다
2542,KB금융,24.07.24,2분기 어닝 서프라이즈 시현. 올해와 내년 추정 순익을 5.0조원과 5.5조원으로 상향,"KB금융에 대한 투자의견 매수를 유지하고, 목표주가를 110,000원으로 상향. 목표가 상향은 2분기 실적 호조세를 반영해 올해 이후의 이익추정치를 상향했기 때문. KB금융 2분기 순익은 전년동기대비 15.6% 증가한 1조 7,320억원을 시현해 컨센서스를 큰폭 상회한 어닝 서프라이즈 시현. 1) 시중금리 하락에 따라 유가증권관련익 등의 기타비이자이익이 전분기보다도 증가했고, 2) 홍콩 ELS 관련 충당부채 환입이 1,200억원 발생한데다(영업외손익) 3) 신탁사 책임준공 관련 추가 충당금 640억원 적립에도 불구하고 금호타이어 환입이 590억원 발생해 이를 상쇄했으며 PF 정상화 방안 관련 비은행 추가 충당금이 150억원 내외에 그쳤기 때문. 다만 카드 상각 규모 확대로 카드 충당금이 늘어나고, 은행도 건전성 분류 기준 강화로 NPL이 증가하면서 충당금이 전분기보다 증가해 그룹 대손비용은 5,500억원 수준을 기록. 4) 2분기 원화대출 성장률은 2.3%로 양호한 성장률을 기록했고, 은행 NIM은 1.84%로 3bp 내외 하락했지만 타행보다는 하락 폭이 적을 것으로 추정됨. 2024년 연간 추정 순익은 보수적인 기준으로도 5.0조원을 상회해 올해 ROE와 ROA는 각각 8.4%와 0.67%를 기록할 전망. 본원 수익성인 ROA가 3개년 연속 상승하고 있는데다 홍콩 ELS 손실 요인이 소멸되는 기저효과로 인해 2025년에도 순익이 10% 이상 증가, ROA는 0.7%를 상회할 것으로 기대",15.0,9.0,19.0,36.0,9.0,0.0,0.0,12.0,0.0,9.0,6.0,1.0,2.0,0.0,8.0,2.0,1.0,4.0,8.0,9.0,1.0,1.0,5.0,2.0,0.0,2.0,1.0,3.0,0.0,1.0,0.0,0.0,0.0,0.0,5.0,1.0,0.0,0.0,0.0,0.0,15.0,9.0,19.0,36.0,9.0,0.0,0.0,12.0,0.0,9.0,6.0,1.0,2.0,0.0,8.0,2.0,1.0,4.0,8.0,9.0,1.0,1.0,5.0,2.0,0.0,2.0,1.0,3.0,0.0,1.0,0.0,0.0,0.0,0.0,5.0,1.0,0.0,0.0,0.0,0.0,KB금융,93500,91500
2551,SGC에너지,24.07.24,"목표주가 42,000원, 투자의견 매수 유지","SGC에너지 목표주가 42,000원과 투자의견 매수를 유지한다. 2분기 실적은 시장 기대치를 상회했다. REC 재정산분 반영으로 이익이 유의미하게 성장했다. 발전 부문은 SMP가 낮아진 상황에서도 가동일수 증가 및 원재료 가격 하락으로 외형과 이익률이 동시에 개선되었다.  건설 부문의 흑자 지속도 긍정적인 지점이며 4분기부터 빠른 회복이 기대된다. 하반기 SMP  상승 가능성을 감안하면 연간 실적 눈높이는 상향될 수 있다. 2024년 기준 PER 4.1배, PBR 0.5배다.",19.0,15.0,30.0,50.0,12.0,5.0,11.0,8.0,2.0,10.0,9.0,7.0,3.0,1.0,3.0,1.0,2.0,3.0,7.0,14.0,8.0,1.0,9.0,0.0,1.0,1.0,0.0,0.0,0.0,3.0,0.0,3.0,0.0,0.0,7.0,0.0,0.0,0.0,0.0,0.0,19.0,15.0,30.0,50.0,12.0,5.0,11.0,8.0,2.0,10.0,9.0,7.0,3.0,1.0,3.0,1.0,2.0,3.0,7.0,14.0,8.0,1.0,9.0,0.0,1.0,1.0,0.0,0.0,0.0,3.0,0.0,3.0,0.0,0.0,7.0,0.0,0.0,0.0,0.0,0.0,SGC에너지,28950,25450
2554,HD현대일렉트릭,24.07.24,"목표주가 420,000원으로 상향, 투자의견 매수 유지","HD현대일렉트릭 목표주가를 420,000원으로 기존대비 50% 상향하며 투자의견 매수를 유지한다. 2025년 예상 EPS에 목표 PER 20배를 적용했다. 2분기 실적은 시장 컨센서스를 크게 상회했다. 2024년 2분기 말 기준 신규 수주 8.8억달러 및 수주잔고 52.5억달러를 기록했다. 연초 제시된 2024년 수주 목표 37.4억달러 대비 60%를 상회하는 모습이다. 3분기 이후에 나타날 수 있는 일시적 외형 둔화 가능성을 감안하더라도 기존 제시된 가이던스는 상회할 여지가 많다. 수주 마진이 견조한 북미향 잔고와 매출 비중 상승에 따라서 전사 실적 또한 중장기 우상향 흐름이 예상된다. 2024년 추정치 기준 PER 18.8배, PBR 6.6배다.",0.0,1.0,0.0,0.0,0.0,0.0,0.0,0.0,0.0,0.0,0.0,0.0,0.0,0.0,0.0,0.0,0.0,0.0,0.0,0.0,0.0,0.0,0.0,0.0,0.0,0.0,0.0,0.0,0.0,0.0,0.0,0.0,0.0,0.0,0.0,0.0,0.0,0.0,0.0,0.0,0.0,1.0,0.0,0.0,0.0,0.0,0.0,0.0,0.0,0.0,0.0,0.0,0.0,0.0,0.0,0.0,0.0,0.0,0.0,0.0,0.0,0.0,0.0,0.0,0.0,0.0,0.0,0.0,0.0,0.0,0.0,0.0,0.0,0.0,0.0,0.0,0.0,0.0,0.0,0.0,HD현대일렉트릭,319000,361000
2559,SK텔레콤,24.07.24,"매수 유지, 목표가 7만원으로 유지, 12개월/8월 통신서비스 업종 최선호주로 제시","SKT에 대한 투자의견 매수, 12개월 목표가 7만원을 유지한다. 또 통신서비스 업종 내 12개월 및 8월 Top pick으로 제시한다. 이러한 판단을 하는 이유는 1) 2024년 2분기 어닝 서프라이즈에 힘입어 2024년 연간 연결 영업이익 감소 가능성이 낮아졌고, 2) SK그룹 지배구조 개편 작업이 본격화되고 있어 SKT 주가 상승 기대감이 높아질 수 있으며, 3) 당분간 높은 주주이익환원 규모를 유지할 수 밖에 없다는 현실을 감안할 때 주주이익환원규모 대비 확실한 주가 저평가 상황이라고 판단되기 때문이다.",43.0,7.0,44.0,140.0,23.0,6.0,15.0,19.0,5.0,18.0,20.0,18.0,11.0,2.0,13.0,5.0,5.0,18.0,26.0,24.0,13.0,1.0,16.0,1.0,3.0,11.0,7.0,7.0,0.0,4.0,15.0,1.0,1.0,0.0,0.0,0.0,0.0,0.0,0.0,0.0,43.0,7.0,44.0,140.0,23.0,6.0,15.0,19.0,5.0,18.0,20.0,18.0,11.0,2.0,13.0,5.0,5.0,18.0,26.0,24.0,13.0,1.0,16.0,1.0,3.0,11.0,7.0,7.0,0.0,4.0,15.0,1.0,1.0,0.0,0.0,0.0,0.0,0.0,0.0,0.0,SK텔레콤,56300,55300
2562,KT,24.07.24,"중립 유지/TP 45,000원으로 유지, 실적 부진에도 현 시점 매수 적절하다고 판단","KT에 대한 투자 의견을 중립으로 유지한다. 일회성 수익이 없다고 가정 시 이동전화매출액과 인건비 등 제반 경비 흐름을 고려하면 2024년에도 영업이익 감소 가능성이 높고, 이익 모멘텀 부재 국면임을 감안 시 Multiple 확장 국면이 나타나기 어려울 것으로 전망되기 때문이다. 하지만 12개월 목표주가는 45,000원을 유지하며 트레이딩 차원에서 현 시점 매수 적절하다고 판단한다. 2분기 실적이 YoY 영업이익 감소를 기록할 전망이지만 그 폭이 크지 않아 2024년 연간 영업이익 감소 폭이 당초 예상보다 적을 것으로 보이며 주주이익환원 규모가 높게 유지될 것임을 감안하면 매력적인 주가 수준이기 때문이다.",30.0,17.0,12.0,46.0,10.0,12.0,23.0,10.0,4.0,11.0,7.0,5.0,7.0,1.0,6.0,1.0,4.0,2.0,4.0,9.0,3.0,1.0,6.0,0.0,1.0,5.0,1.0,1.0,0.0,2.0,1.0,2.0,0.0,0.0,4.0,0.0,0.0,0.0,0.0,0.0,30.0,17.0,12.0,46.0,10.0,12.0,23.0,10.0,4.0,11.0,7.0,5.0,7.0,1.0,6.0,1.0,4.0,2.0,4.0,9.0,3.0,1.0,6.0,0.0,1.0,5.0,1.0,1.0,0.0,2.0,1.0,2.0,0.0,0.0,4.0,0.0,0.0,0.0,0.0,0.0,KT,42950,41800
2565,LG유플러스,24.07.24,"투자의견 중립/목표가 13,000원 유지, 차라리 길게 보시고 매수하세요","LGU+에 대한 투자의견 중립을 유지한다. 이동전화매출액 성장률 둔화 양상, 영업전산시스템 상각 처리 이슈 등을 감안 시 2024년에도 영업이익 감소 가능성이 높고 재료 부재로 낮은 Multiple이 지속될 가능성이 높기 때문이다. 하지만 12개월 목표주가는 13,000원을 유지하며 투자 전략상 8월에도 장기적인 관점 하에 저점 매수를 지속할 것을 권한다. 기대 배당 수익률로 보면 9,500원 수준이 진 바닥일 가능성이 높은 가운데 차세대 요금제 출시를 기반으로 2025년에는 LGU+ 주가가 재차 대세 상승기로 진입할 가능성이 높기 때문이다.",43.0,12.0,34.0,41.0,16.0,21.0,20.0,17.0,11.0,10.0,6.0,5.0,2.0,1.0,6.0,1.0,6.0,6.0,7.0,6.0,4.0,2.0,6.0,2.0,0.0,2.0,1.0,2.0,1.0,1.0,0.0,0.0,0.0,0.0,3.0,0.0,0.0,0.0,0.0,0.0,43.0,12.0,34.0,41.0,16.0,21.0,20.0,17.0,11.0,10.0,6.0,5.0,2.0,1.0,6.0,1.0,6.0,6.0,7.0,6.0,4.0,2.0,6.0,2.0,0.0,2.0,1.0,2.0,1.0,1.0,0.0,0.0,0.0,0.0,3.0,0.0,0.0,0.0,0.0,0.0,LG유플러스,9840,10050
2567,KB금융,24.07.24,"2Q24 지배 순익 1조 7,324억원(+16% YoY), 어닝 서프라이즈","KB금융의 2Q24 지배주주 순익은 1조 7,324억원(+16% YoY)으로 시장 컨센서스를 15% 상회하는 어닝 서프라이즈를 기록. 특이요인으로 충당금에서 특정 기업에 대한 환입 440억원 및 신탁사 일부 사업장 전입 640억원, 영업외수익에서 ELS 배상 충당부채 환입 880억원 등이 있었음. 이외 FVPL손익 증가에 따른 비이자이익 호조와 예상 이하의 판관비가 호실적의 원인이라고 판단 NIM은 지주 및 은행이 3bp QoQ 하락. 은행 원화대출은 기업과 가계가 함께 2%대 QoQ 증가해 예상을 상회함 대손비용률(CCR)은 0.49%, 환입 및 전입 요인 제외시 0.48%를 기록. 당분기 실적 호조를 감안해, 3Q24에 반영할 것으로 가정했던 한화오션에 대한 충당금 환입을 2025년으로 미루어 추정하였음",33.0,1.0,38.0,111.0,15.0,10.0,7.0,20.0,10.0,24.0,16.0,13.0,4.0,2.0,6.0,3.0,7.0,0.0,12.0,23.0,8.0,5.0,14.0,1.0,3.0,4.0,8.0,3.0,0.0,1.0,10.0,1.0,0.0,0.0,0.0,1.0,0.0,0.0,0.0,0.0,33.0,1.0,38.0,111.0,15.0,10.0,7.0,20.0,10.0,24.0,16.0,13.0,4.0,2.0,6.0,3.0,7.0,0.0,12.0,23.0,8.0,5.0,14.0,1.0,3.0,4.0,8.0,3.0,0.0,1.0,10.0,1.0,0.0,0.0,0.0,1.0,0.0,0.0,0.0,0.0,KB금융,93500,91500
2576,한국전력,24.07.24,2Q24 Preview: 영업이익 흑자 지속 예상,"한국전력의 2분기 매출액은 21.1조 원, 영업이익 1.1조 원으로 전년동기 대비 각각 +7.8%, 흑자전환을 기록한 것으로 추정한다. 시장 컨센서스와 유사한 수치다. 총 매출액은 전기판매량 증가가 미미했음에도 불구하고 전기료 인상 효과에 따라 성장을 기록한 것으로 파악된다. 영업이익은 전기판매수익 증가와 연료비 감소 효과로 흑자 기조를 지속하겠으나, 전분기 대비로는 전기 판매량 감소, 환율 상승 등의 영향으로 감소한 것으로 추정했다.",10.0,3.0,13.0,45.0,6.0,0.0,4.0,5.0,0.0,5.0,6.0,3.0,4.0,0.0,4.0,3.0,3.0,5.0,7.0,7.0,1.0,3.0,9.0,0.0,1.0,2.0,5.0,0.0,0.0,2.0,0.0,1.0,1.0,1.0,3.0,0.0,1.0,0.0,0.0,0.0,10.0,3.0,13.0,45.0,6.0,0.0,4.0,5.0,0.0,5.0,6.0,3.0,4.0,0.0,4.0,3.0,3.0,5.0,7.0,7.0,1.0,3.0,9.0,0.0,1.0,2.0,5.0,0.0,0.0,2.0,0.0,1.0,1.0,1.0,3.0,0.0,1.0,0.0,0.0,0.0,한국전력,21250,23600
2578,대덕전자,24.07.24,FC-BGA 신규 고객사 확보와 MLB 라인업 고도화 기대,"투자의견과 목표주가를 유지한다. ① 업황과 주가는 하방 경직성을 가진 구간에 있으며, ② 4Q24 FC-BGA 신규 고객사 확보가 기대되며 ③ AI, 스위치 중심으로 MLB 라인업이 고도화될 전망이다. 업황 개선 속도가 더딤에도 차별화된 주가 흐름을 기대할 수 있다.① 최악을 지난 FC-BGA 업황: 중/저가 FC-BGA 업황 개선은 여전히 더딘 편이다. PC, 가전, 전장 등 수요 회복이 전제되어야 한다. 다만 이미 최악을 지난 것으로 판단한다. 4Q23을 기점으로 매출 증감률이 재고자산 증감률을 앞서기 시작했다[그림3]. 실제 동사를 포함한 주요 반도체 기판 업체들의 재고는 1.6년 이전으로 회귀했다[그림4]. 매출은 완만한 속도로 매월 개선되고 있는 추세다. 방향이 바뀐 것이다.② FC-BGA 신규 고객사 확보: 업황 회복은 더디나, 회사는 자구 노력으로 외형 성장의 가시성을 높이고 있다. 대표적으로, 신규 전장용 FC-BGA 업체를 확보한 것으로 파악된다. 상반기 중 생산 라인에 대한 실사를 끝내고 공급 시점을 논의하고 있다. 공급이 시작된다면 FC-BGA 가동률이 70% 이상으로 개선되며 턴어라운드 가능성이 높아질 것이다. 참고로, 1Q24 기준 가동률은 40%에 그치며 적자를 지속한 것으로 파악된다. 당사는 연간 FC-BGA 매출은 ‘22년 2,730억원, ‘23년 2,249억원, ‘24년 2,250억원, ‘25년 3,150억원으로 전망한다.③ MLB 라인업 고도화: 4Q24 이후 AI 서버, 스위치를 중심으로 MLB 제품 라인업을 다각화한다. 동사 MLB 생산 능력은 2,000억원 수준이다. 국내 경쟁사 대비 상대적으로 캐파가 작기 때문에, 지난해까지는 고부가/대물량 수주를 받기 어려웠다. 다만 2Q23 이래로 저부가 MLB 생산분을 비워냈고, 업황 재고조정까지 겹치며 이제는 자연스럽게 고부가 MLB에 대한 대응 여력이 생긴 상태다. 회사는 먼저 AI 서버용 보드, ‘25년 스위치용 보드 공급을 계획하고 있다.",24.0,14.0,55.0,78.0,10.0,9.0,12.0,11.0,3.0,11.0,12.0,10.0,9.0,3.0,5.0,2.0,8.0,7.0,7.0,13.0,11.0,1.0,13.0,0.0,13.0,5.0,1.0,4.0,0.0,2.0,0.0,2.0,1.0,1.0,8.0,1.0,0.0,0.0,0.0,0.0,24.0,14.0,55.0,78.0,10.0,9.0,12.0,11.0,3.0,11.0,12.0,10.0,9.0,3.0,5.0,2.0,8.0,7.0,7.0,13.0,11.0,1.0,13.0,0.0,13.0,5.0,1.0,4.0,0.0,2.0,0.0,2.0,1.0,1.0,8.0,1.0,0.0,0.0,0.0,0.0,대덕전자,17220,15390
