,종목명,날짜,제목,본문,SN_caller,SL_caller,NNP_caller,NNG_caller,SF_caller,SS_caller,SW_caller,SP_caller,NR_caller,NNB_caller,JKB_caller,JX_caller,XSN_caller,JC_caller,JKO_caller,MAG_caller,JKG_caller,VV_caller,EC_caller,XSV_caller,EP_caller,MAJ_caller,ETM_caller,XPN_caller,MM_caller,JKS_caller,VCP_caller,VA_caller,NA_caller,XR_caller,ETN_caller,XSA_caller,SO_caller,NP_caller,EF_caller,VX_caller,VCN_caller,SH_caller,IC_caller,JKV_caller,SN_other,SL_other,NNP_other,NNG_other,SF_other,SS_other,SW_other,SP_other,NR_other,NNB_other,JKB_other,JX_other,XSN_other,JC_other,JKO_other,MAG_other,JKG_other,VV_other,EC_other,XSV_other,EP_other,MAJ_other,ETM_other,XPN_other,MM_other,JKS_other,VCP_other,VA_other,NA_other,XR_other,ETN_other,XSA_other,SO_other,NP_other,EF_other,VX_other,VCN_other,SH_other,IC_other,JKV_other,stock_name,price,price + 30days
0,대우건설,24.07.31,"2Q24 영업이익, 컨센서스(1,237억원) -15% 하회","2Q24 매출액 2.8조원(YoY -14%), 영업이익 1,048억원(YoY -52%, OPM 3.7%)으로 영업이익은 당사 추정치와 컨센서스를 각각 -18%, -15% 하회. 싱가폴, 중동 등 해외 현장에서의 비용 증가에 따라 토목 부문의 GPM이 3.3%(QoQ -7.6%p)로 악화되었으나 일부 주택/건축 현장에서의 실행원가 개선 및 도급증액, 플랜트 매출 믹스 개선, 연결종속 부문의 토지매각 이익 인식에 따라 GPM은 9.8%(QoQ +1.1%p) 기록. 그러나 지방 소재 준공 후 미분양 사업장의 매출채권에 대한 대손상각비 -520억원이 반영되며 실적이 부진",20.0,10.0,19.0,36.0,8.0,14.0,10.0,8.0,2.0,3.0,7.0,2.0,1.0,1.0,1.0,1.0,5.0,3.0,4.0,2.0,1.0,2.0,1.0,1.0,1.0,2.0,0.0,0.0,0.0,0.0,0.0,0.0,0.0,0.0,0.0,0.0,0.0,0.0,0.0,0.0,20.0,10.0,19.0,36.0,8.0,14.0,10.0,8.0,2.0,3.0,7.0,2.0,1.0,1.0,1.0,1.0,5.0,3.0,4.0,2.0,1.0,2.0,1.0,1.0,1.0,2.0,0.0,0.0,0.0,0.0,0.0,0.0,0.0,0.0,0.0,0.0,0.0,0.0,0.0,0.0,대우건설,3795,3600
6,넷마블,24.07.31,변화로 인한 재평가로 인한 큰 폭 주가 상승 전망,"오랜 기간 부진을 끝내고 완전히 달라진 실적과 신작, 그리고 상장사 중 가장 안정적인 포트폴리오로 재평가되며 주가 큰 폭 상승 전망",0.0,0.0,4.0,9.0,0.0,0.0,0.0,1.0,0.0,1.0,1.0,0.0,1.0,1.0,1.0,2.0,0.0,2.0,2.0,1.0,0.0,1.0,3.0,0.0,1.0,0.0,1.0,1.0,0.0,0.0,0.0,0.0,0.0,0.0,0.0,0.0,0.0,0.0,0.0,0.0,0.0,0.0,4.0,9.0,0.0,0.0,0.0,1.0,0.0,1.0,1.0,0.0,1.0,1.0,1.0,2.0,0.0,2.0,2.0,1.0,0.0,1.0,3.0,0.0,1.0,0.0,1.0,1.0,0.0,0.0,0.0,0.0,0.0,0.0,0.0,0.0,0.0,0.0,0.0,0.0,넷마블,59500,47900
8,유한양행,24.07.31,"투자의견 매수, 목표주가 134,000원 유지","목표주가는 SOTP 방식으로 산출. 영업가치는 25년 추정 EBITDA에 Target EV/EBITDA 멀티플 21배 적용하여 4.3조원으로 산정. 비영업가치는 레이저티닙, YH35324 신약가치에 보유지분 가치를 더하여 5.5조원 추정. 총 기업가치는 영업가치에 비영업가치를 더하여 9.9조원으로 산정.",9.0,6.0,11.0,14.0,7.0,0.0,0.0,1.0,3.0,4.0,6.0,4.0,0.0,0.0,2.0,0.0,0.0,2.0,3.0,1.0,0.0,0.0,0.0,2.0,1.0,0.0,0.0,0.0,2.0,0.0,0.0,0.0,0.0,0.0,0.0,0.0,0.0,0.0,0.0,0.0,9.0,6.0,11.0,14.0,7.0,0.0,0.0,1.0,3.0,4.0,6.0,4.0,0.0,0.0,2.0,0.0,0.0,2.0,3.0,1.0,0.0,0.0,0.0,2.0,1.0,0.0,0.0,0.0,2.0,0.0,0.0,0.0,0.0,0.0,0.0,0.0,0.0,0.0,0.0,0.0,유한양행,160000,119700
10,롯데칠성,24.07.31,"투자의견 BUY, 목표주가 170,000원 유지",상반기 부진했던 별도법인은 1) 3분기 계절적 성수기 진입 2) 6월 음료 주요 제품 출고가 인상 3) 원당 가격 하락전환으로 점진적 원가 부담 완화로 하반기 이익 개선 예상. 또한 PCPPI를 포함한 해외 자회사의 외형 성장과 수익성 개선이 이번 분기 확인되며 하반기 실적 기여도 확대 전망 1) 하반기 실적 턴어라운드 2) 해외 사업 확대 3) 낮은 밸류에이션(12MF P/E  8배 수준)은 동사 주가 모멘텀으로 작용하기에 충분하다는 판단,9.0,3.0,13.0,46.0,1.0,8.0,1.0,1.0,0.0,0.0,4.0,3.0,3.0,1.0,1.0,0.0,1.0,1.0,1.0,4.0,1.0,1.0,5.0,0.0,0.0,2.0,0.0,1.0,0.0,2.0,1.0,1.0,0.0,0.0,0.0,0.0,0.0,0.0,0.0,0.0,9.0,3.0,13.0,46.0,1.0,8.0,1.0,1.0,0.0,0.0,4.0,3.0,3.0,1.0,1.0,0.0,1.0,1.0,1.0,4.0,1.0,1.0,5.0,0.0,0.0,2.0,0.0,1.0,0.0,2.0,1.0,1.0,0.0,0.0,0.0,0.0,0.0,0.0,0.0,0.0,롯데칠성,120700,115900
13,현대오토에버,24.07.31,"투자의견 매수 유지, 목표주가 230,000원 상향(+5%)","TP 23만원은 2024~25년 평균 EPS 7,268원에 Target PER 32배 부여. 목표 배수는 실적/성장 기대감 동반 반영됐던 ‘23말~24초 밸류에 3Q24 대규모 일회성 이익 반영에 따른 실적 변동성 감안하여 10% 할인). TP 상향은 이익 추정치 상향에 기인 7/29~30일 NDR을 통해 1) 3Q24 단가협상에 따른 일회성 이익 반영, 2) 그룹사 내 SI 업체로서 입지 확대, 3) SDV 확장에 따른 수혜 가능성 확인. 2H24 1) 3Q 실적 호조, 2) 그룹사 공정개선의 수혜(차세대 ERP/스마트팩토리), 3) 고객사 인도 성장 수혜(차량SW), 4) 자율주행&밸류업 모멘텀 감안 시, 주가 뚜렷한 우상향 예상, 전고점(24만원)에 재차 근접할 가능성 높다고 판단",24.0,14.0,22.0,47.0,3.0,15.0,2.0,11.0,0.0,6.0,8.0,3.0,5.0,0.0,0.0,1.0,1.0,7.0,5.0,4.0,1.0,0.0,9.0,1.0,0.0,0.0,0.0,1.0,0.0,3.0,0.0,1.0,3.0,1.0,0.0,0.0,0.0,0.0,0.0,0.0,24.0,14.0,22.0,47.0,3.0,15.0,2.0,11.0,0.0,6.0,8.0,3.0,5.0,0.0,0.0,1.0,1.0,7.0,5.0,4.0,1.0,0.0,9.0,1.0,0.0,0.0,0.0,1.0,0.0,3.0,0.0,1.0,3.0,1.0,0.0,0.0,0.0,0.0,0.0,0.0,현대오토에버,138700,141100
20,유한양행,24.07.31,2Q24P Review,"연결 기준, 2Q24P 매출액 5,283억(+7% YoY), 영업이익 185억원(-32% YoY), 영업이익률 3.5%(-2%p YoY)을 기록하며 매출액은 컨센서스에 부합, 영업이익은 -9% 하회했다.",10.0,6.0,6.0,9.0,2.0,8.0,6.0,5.0,2.0,1.0,1.0,2.0,1.0,0.0,0.0,0.0,0.0,0.0,1.0,2.0,1.0,0.0,1.0,0.0,0.0,0.0,0.0,0.0,0.0,0.0,0.0,0.0,0.0,0.0,1.0,0.0,0.0,0.0,0.0,0.0,10.0,6.0,6.0,9.0,2.0,8.0,6.0,5.0,2.0,1.0,1.0,2.0,1.0,0.0,0.0,0.0,0.0,0.0,1.0,2.0,1.0,0.0,1.0,0.0,0.0,0.0,0.0,0.0,0.0,0.0,0.0,0.0,0.0,0.0,1.0,0.0,0.0,0.0,0.0,0.0,유한양행,160000,119700
22,대우건설,24.07.31,2Q24 Review: 시장 예상치 하회,"2024년 2분기, 대우건설 잠정 실적은 매출액 2.82조원(-13.8%, YoY), 영업이익 1,048억원(-51.9%, YoY)으로 시장 예상치(1,237억원, 1개월 기준)를 15% 하회했다. 토목 부문에서는 싱가포르와 중동 현장의 원가 상승 요인이 반영됐으나, 주택을 비롯한 사업 부문 원가율은 전분기 대비 개선되었다. 연결종속 부문에서는 베트남 토지 매각 실적이 마진율 개선 요인으로 작용했다. 다만, 판매관리비에는 2023년 4분기에 이어 미분양 주택 관련 대손 약 520억원이 반영되었다. 세전이익 개선에는 나이지리아 현지 통화 약세에 따른 환 평가이익 300억원이 기여했다.",18.0,2.0,18.0,41.0,8.0,8.0,3.0,9.0,4.0,7.0,8.0,6.0,2.0,1.0,2.0,1.0,1.0,1.0,2.0,7.0,6.0,1.0,2.0,0.0,3.0,4.0,0.0,0.0,0.0,1.0,0.0,1.0,0.0,0.0,5.0,0.0,0.0,0.0,0.0,0.0,18.0,2.0,18.0,41.0,8.0,8.0,3.0,9.0,4.0,7.0,8.0,6.0,2.0,1.0,2.0,1.0,1.0,1.0,2.0,7.0,6.0,1.0,2.0,0.0,3.0,4.0,0.0,0.0,0.0,1.0,0.0,1.0,0.0,0.0,5.0,0.0,0.0,0.0,0.0,0.0,대우건설,3795,3600
28,한화시스템,24.07.31,2Q24 Review: 영업이익 컨센서스 79.1% 상회,"2Q24 매출액 6,873억 원 (+12.6% YoY, 컨센 대비 2% 상회), 영업이익 798억 원 (+167.1% YoY, 컨센 대비 79.1% 상회)으로 어닝 서프라이즈를 기록했다. 전사 영업이익률은 무려 11.6%에 달했다. 주된 컨센서스 상회 요인은 폴란드 K2 납품 대량인식과 방산원가 보상금 정산이다. 반면, 세전이익과 당기순이익은 각각 86억 원, 271억 원에 불과했다. 지분법 손실 95억 원 (오버에어 40억, 한화페이저 55억) 및 오버에어 전환사채 미전환에 따른 대손상각비 446억원 발생 영향이다. 방산 부문은 매출액 4,932억 원 (+10.1% YoY), 영업이익 609억 원 (+116% YoY, OPM 12.3%)으로 호실적을 달성했다. 하반기에 인도될 폴란드 K2 38대에 대한 항전장비 물량납품이 대량인식된 것으로 파악된다. ICT 부문도 매출액 1,901억 원 (+17.1% YoY), 영업이익은 232억 원 (+110.9% YoY, OPM 12.2%)으로 견조했다. 캡티브 물량 외에도 신한EZ손해보험 차세대 시스템 등 고마진 사업의 비중이 증가한 영향이다. 더불어, PPA 상각비 미반영 효과도 수익성을 높이는데 일조했다.",37.0,11.0,36.0,51.0,19.0,14.0,17.0,14.0,12.0,14.0,10.0,10.0,3.0,2.0,3.0,2.0,1.0,8.0,4.0,8.0,6.0,1.0,8.0,2.0,2.0,2.0,3.0,2.0,2.0,1.0,0.0,1.0,0.0,0.0,10.0,0.0,0.0,0.0,0.0,0.0,37.0,11.0,36.0,51.0,19.0,14.0,17.0,14.0,12.0,14.0,10.0,10.0,3.0,2.0,3.0,2.0,1.0,8.0,4.0,8.0,6.0,1.0,8.0,2.0,2.0,2.0,3.0,2.0,2.0,1.0,0.0,1.0,0.0,0.0,10.0,0.0,0.0,0.0,0.0,0.0,한화시스템,18600,28250
31,삼성SDI,24.07.31,24 년 2 분기 리뷰: 수요 부진과 재고조정,"2분기 영업이익은 2,802억원(-38%, 이하 YoY)를 기록했다. 컨센서스(3,320억원)을 다소 하회하는 실적이나, 최근 낮아진 시장 눈높이 수준에 부합했다. 전기차 중대형 배터리는 분기 초 예상과 반대로 Q가 25% 감소했고, ASP는 12% 상승했다. 고객사의 EV 수요가 부진한 가운데 재고조정이 본격화되며 반등 시점이 지연된다. ASP 상승은 출하량 감소 환경에서 PHEV 와 배터리’팩’의 판매 비중이 높아졌기 때문이다. 매출이 부진한 가운데 고객사의 보상금으로 영업이익은 전분기대비 소폭 증가했다.",8.0,6.0,10.0,41.0,6.0,7.0,3.0,5.0,2.0,5.0,4.0,5.0,1.0,2.0,1.0,1.0,3.0,1.0,5.0,10.0,6.0,0.0,5.0,0.0,2.0,6.0,1.0,2.0,0.0,1.0,1.0,0.0,0.0,0.0,6.0,2.0,0.0,0.0,0.0,0.0,8.0,6.0,10.0,41.0,6.0,7.0,3.0,5.0,2.0,5.0,4.0,5.0,1.0,2.0,1.0,1.0,3.0,1.0,5.0,10.0,6.0,0.0,5.0,0.0,2.0,6.0,1.0,2.0,0.0,1.0,1.0,0.0,0.0,0.0,6.0,2.0,0.0,0.0,0.0,0.0,삼성SDI,334500,262500
35,한화시스템,24.07.31,"2분기 매출 6,873억원/영업이익 798억원","한화시스템의 2분기 매출은 6,873억원/영업이익 798억원(OPM 11.6%)로 컨센서스 및 당사 추정치 대비 매출은 부합하였으며, 영업이익은 컨센서스 및 당사 추정치를 각각 +15.6%, +31.6%를 상회하는 호실적을 기록하였다. 방산 및 ICT부문이 고른 성장을 보였다. 방산 매출 4,932억원/영업이익 609억원(OPM 12.3%)를 기록했으며, 폴란드 K2사통장비 매출 증가 및 TICN4차 양산으로 인한 매출 증가와 수출사업 비중 증가 및 내부 원가절감 노력에 힘입어 영업이익의 상승을 보였다. ICT부문에서도 대규모 사업인 한화에어로시스템 ERP사업 등의 매출이 늘어나면서 매출 성장 및 영업이익 증가를 기록하였다. 다만 하반기에는 상반기 순연되었던 인력 채용 및 국내사업 개발비용 집행(상반기 110억/하반기 240억 예상)및 통상 4분기 지급되는 성과급 관련 비용 등을 반영, 영업이익률은 상반기보다 다소 감소할 것으로 전망한다. 그러나 2025년에는 올해 6월 계약된 KF-21용 AESA레이더 최초양산, K-2 인도 대수 증가(24년 56대->25년 96대), 사우디 M-SAM 양산 시작 등 매출 및 영업이익 상승 포인트가 줄줄이 대기하고 있어 다시금 안정적인 상승 흐름을 보일 전망이다.",23.0,11.0,39.0,72.0,10.0,12.0,6.0,11.0,6.0,12.0,8.0,7.0,5.0,1.0,9.0,5.0,3.0,8.0,7.0,12.0,7.0,11.0,10.0,1.0,0.0,3.0,3.0,0.0,0.0,0.0,0.0,0.0,0.0,0.0,6.0,0.0,0.0,0.0,0.0,0.0,23.0,11.0,39.0,72.0,10.0,12.0,6.0,11.0,6.0,12.0,8.0,7.0,5.0,1.0,9.0,5.0,3.0,8.0,7.0,12.0,7.0,11.0,10.0,1.0,0.0,3.0,3.0,0.0,0.0,0.0,0.0,0.0,0.0,0.0,6.0,0.0,0.0,0.0,0.0,0.0,한화시스템,18600,28250
38,대우건설,24.07.31,"투자의견 Buy 유지, 목표주가 5,500원으로 하향","대우건설에 대해 투자의견 Buy를 유지하고, 목표주가를 기존 6,200원에서 5,500원으로 하향한다. 예상 대비 느린 주택 마진 개선 흐름을 반영하여 2024년, 2025년 EPS를 하향 조정하고, Target P/B를 기존 0.55배에서 0.50배로 하향 조정했다. 현재 주가는 12개월 포워드 P/E, P/B 각각 4.5배, 0.38배에 위치해 있다. 경쟁사 대비 주택 마진 개선세가 느리고, 추가적인 미분양 손실 가능성을 배제할 수 없다. 다만 수의계약 중심의 대규모 해외 수주 파이프라인을 보유하고 있어, 목표한 해외 수주 달성 시 2025년 이후 비주택 부문이 실적 개선을 이끌 것으로 보인다.",15.0,9.0,19.0,36.0,9.0,0.0,0.0,12.0,0.0,9.0,6.0,1.0,2.0,0.0,8.0,2.0,1.0,4.0,8.0,9.0,1.0,1.0,5.0,2.0,0.0,2.0,1.0,3.0,0.0,1.0,0.0,0.0,0.0,0.0,5.0,1.0,0.0,0.0,0.0,0.0,15.0,9.0,19.0,36.0,9.0,0.0,0.0,12.0,0.0,9.0,6.0,1.0,2.0,0.0,8.0,2.0,1.0,4.0,8.0,9.0,1.0,1.0,5.0,2.0,0.0,2.0,1.0,3.0,0.0,1.0,0.0,0.0,0.0,0.0,5.0,1.0,0.0,0.0,0.0,0.0,대우건설,3795,3600
44,롯데정밀화학,24.07.31,"2Q24 Review: 케미칼, 그린소재 모두 개선","롯데정밀화학 4Q23 매출액 4,221억원(-2.1% YoY, +5.7% QoQ), 영업이익 171억원(-75.2% YoY, +58.8% QoQ)을 기록했다. 케미칼과 그린소재 모두 전분기대비 개선된 실적을 기록했다. 케미칼은 가성소다 ASP 상승, 출하량 증가에 따라 ECH 부진 지속에도 불구하고 증익 가능했을 것으로 판단된다. 가성소다 가격은 2Q24 +9.9% QoQ 를 기록했으며, 1Q24 정기보수 종료, 전방수요 회복에 따라 출하량은10% QoQ 증가했을 것으로 추정된다. 그린소재의 경우 2Q24 헤셀로스 증설에 따라 산업용 전체 +10% QoQ 의 출하량 증가를 기록했을 것으로 파악된다. 다만, 헤셀로스 증설 초기비용이 반영되며 산업용 그린소재 이익 개선은 제한됐을 것으로 판단된다. 식의약용의 경우 ASP 회복 지속되며 1Q24 대비 증익 가능했을 것으로 추정된다.",19.0,15.0,30.0,50.0,12.0,5.0,11.0,8.0,2.0,10.0,9.0,7.0,3.0,1.0,3.0,1.0,2.0,3.0,7.0,14.0,8.0,1.0,9.0,0.0,1.0,1.0,0.0,0.0,0.0,3.0,0.0,3.0,0.0,0.0,7.0,0.0,0.0,0.0,0.0,0.0,19.0,15.0,30.0,50.0,12.0,5.0,11.0,8.0,2.0,10.0,9.0,7.0,3.0,1.0,3.0,1.0,2.0,3.0,7.0,14.0,8.0,1.0,9.0,0.0,1.0,1.0,0.0,0.0,0.0,3.0,0.0,3.0,0.0,0.0,7.0,0.0,0.0,0.0,0.0,0.0,롯데정밀화학,46500,36900
47,한미반도체,24.07.31,,,0.0,1.0,0.0,0.0,0.0,0.0,0.0,0.0,0.0,0.0,0.0,0.0,0.0,0.0,0.0,0.0,0.0,0.0,0.0,0.0,0.0,0.0,0.0,0.0,0.0,0.0,0.0,0.0,0.0,0.0,0.0,0.0,0.0,0.0,0.0,0.0,0.0,0.0,0.0,0.0,0.0,1.0,0.0,0.0,0.0,0.0,0.0,0.0,0.0,0.0,0.0,0.0,0.0,0.0,0.0,0.0,0.0,0.0,0.0,0.0,0.0,0.0,0.0,0.0,0.0,0.0,0.0,0.0,0.0,0.0,0.0,0.0,0.0,0.0,0.0,0.0,0.0,0.0,0.0,0.0,한미반도체,101500,80600
48,칩스앤미디어,24.07.31,I. 2Q24 Review & 투자의견,"전일(07/30) 발표한 2분기 잠정실적(연결기준)은 매출액 61억원, 영업이익 6억원으로 전년동기 대비 매출액은 10.9% 소폭 감소하였고, 영업이익은 66.5% 감소함. 시장 컨센서스(매출액 59 억원, 영업이익 12 억원) 대비 크게 매출액은 유사한 수준을 보였으나 영업이익은 크게 하회함. 실적이 크게 부진했던 이유는 ① 경기침체 지속 영향으로 다수 고객사 프로젝트가 하반기로 순연되면서 라이선스 매출이 전년동기 대비 14.4% 감소하였고, ② 전방 시장 IT 기기의 수요 감소로 인하여 로열티 매출도 전년동기 대비 10.8%  감소하였기 때문임. 2 분기 실적에서 긍정적인 것은 ① 라이선스 계약건수가 7 건으로 전년동기 3 건 대비 2 배나 많았고, ② 동사의 로열티를 적용한 칩 판매수가 전년동기 대비 7.3% 증가한 5,400만개를 넘어섰음. 라이선스 계약 건수가 지난해 3분기부터 6건 이상을 유지하고 있는 것은 긍정적임. 라이선스 계약은 보통 2~3 년 후 로열티 매출로 이어질 가능성이 높기 때문에 중장기 성장에 긍정적임. 또한, 동사의 로열티 적용 칩 수도 지난해 4 분기부터 전년동기 대비 증가세를 유지하고 있어 향후 로열티 매출 성장세 유지 가능성을 높이고 있음. 2 분기에 진행된 라이선스 계약은 총 7 건이었음. 이중 기존 고객인 NXP, 글로벌 G 사 등으로부터 신규 라이선스 계약을 체결함. 향후 AI 경쟁으로 데이터센터 중심의 고용량, 고성능 반도체 공급이 늘어나고, AI SoC Target 프로젝트는 지속될 것으로 전망하고 있음. 전방산업별로 보면, 모바일과 홈가전 부문이 전년 동기 대비 각각 1,977.4%, 61.0% 증가하며 큰 성장세를 보였지만, 산업용 부문은 61.1% 감소하며 부진한 실적을 보였음. 국가별로 살펴보면, 매출 비중이 가장 큰 중국 시장에서 전년동기 대비 43.2% 감소하면서 실적 부진을 보였지만, 일본, 미국을 제외한 기타 지역에서 70.2% 증가하며 고객 지역의 다양화가 추진되고 있어 긍정적임. 결론적으로 1 분기에 이어 2 분기도 부진한 매출을 보였으며, 영업이익은 전분기에 이어 소폭 개선세를 보였음.",43.0,7.0,44.0,140.0,23.0,6.0,15.0,19.0,5.0,18.0,20.0,18.0,11.0,2.0,13.0,5.0,5.0,18.0,26.0,24.0,13.0,1.0,16.0,1.0,3.0,11.0,7.0,7.0,0.0,4.0,15.0,1.0,1.0,0.0,0.0,0.0,0.0,0.0,0.0,0.0,43.0,7.0,44.0,140.0,23.0,6.0,15.0,19.0,5.0,18.0,20.0,18.0,11.0,2.0,13.0,5.0,5.0,18.0,26.0,24.0,13.0,1.0,16.0,1.0,3.0,11.0,7.0,7.0,0.0,4.0,15.0,1.0,1.0,0.0,0.0,0.0,0.0,0.0,0.0,0.0,칩스앤미디어,칩스앤미디어에 해당하는 종목이 없습니다,칩스앤미디어에 해당하는 종목이 없습니다
49,PI첨단소재,24.07.31,"2Q24 영업이익 177억원, 시장 컨센서스 상회","2Q24 실적은 매출액 737억원(+42% QoQ, +22% YoY), 영업이익 177억원(+617% QoQ, +617% YoY), opm 24.0%으로, 시장 컨센서스(134억원)를 상회하며 6개 분기 만에 20%대의 영업이익률을 회복했다. 2H24 플래그십 스마트폰 출시를 앞둔 고객사들의 재고 축적 수요가 확대되며 전 사업부의 실적이 성장한 가운데 특히 방열시트용 매출액이 +142% QoQ, +51%YoY 증가했다. 신규 라인(9호기) 가동을 반영한 2Q24 가동률은 63.7%(+13.7%p QoQ)로, 1Q와 동일한 8개 라인 기준으로 고려 시 가동률이 70%를 상회한 것으로 파악된다. 영업이익률은 24.0%(+19.2%p QoQ, +19.9%p YoY)로, 조업도 손실 반영에도 불구하고 가동률 상승 및 원재료 가격 하락, 충당금 환입 등의 효과가 맞물리며 가파른 회복세를 시현했다.",30.0,17.0,12.0,46.0,10.0,12.0,23.0,10.0,4.0,11.0,7.0,5.0,7.0,1.0,6.0,1.0,4.0,2.0,4.0,9.0,3.0,1.0,6.0,0.0,1.0,5.0,1.0,1.0,0.0,2.0,1.0,2.0,0.0,0.0,4.0,0.0,0.0,0.0,0.0,0.0,30.0,17.0,12.0,46.0,10.0,12.0,23.0,10.0,4.0,11.0,7.0,5.0,7.0,1.0,6.0,1.0,4.0,2.0,4.0,9.0,3.0,1.0,6.0,0.0,1.0,5.0,1.0,1.0,0.0,2.0,1.0,2.0,0.0,0.0,4.0,0.0,0.0,0.0,0.0,0.0,PI첨단소재,20700,17190
50,한미약품,24.07.31,2Q24 Review: 역시 영업실적이 돋보인 상반기,"동사의 2분기 연결기준 매출액은 3,781억원(YoY +10.3%, QoQ -6.3%), 영업이익은 581억원(YoY +75.3%, OPM 15.4%)으로, 당사의 추정치(매출액 3,831억원, 영업이익 571억원) 및 컨센서스(매출액 3,882억원, 영업이익 559억원)에 대체로 부합하는 실적을 달성했다. 별도 한미약품은 의료파업에 영향이 적은 만성질환 품목 로수젯과 아모잘탄패밀리의 지속적인 성장에 따라 매출액 2,818억원(YoY +11.3%)을 기록, 고마진 품목 중심의 제품믹스와 영업 레버리지를 통해 수익성 개선을 이루었다(영업이익 321억원, YoY +157.0%, OPM 11.4%). 자회사 북경한미는 주요품목 매창안(YoY+23.4%) 및 리똥(YoY+21.6%)의 높은 매출성장이 나타났으며 정밀화학은 고마진 항생제의 수출 성장에 따라 분기 흑자전환을 달성했다. 2분기 실적을 반영하여 연간 연결기준 매출액 1조 6,265억원(YoY+9.1%), 영업이익 2,684억원(YoY+21.6%, OPM 16.5%)으로 추정한다.",43.0,12.0,34.0,41.0,16.0,21.0,20.0,17.0,11.0,10.0,6.0,5.0,2.0,1.0,6.0,1.0,6.0,6.0,7.0,6.0,4.0,2.0,6.0,2.0,0.0,2.0,1.0,2.0,1.0,1.0,0.0,0.0,0.0,0.0,3.0,0.0,0.0,0.0,0.0,0.0,43.0,12.0,34.0,41.0,16.0,21.0,20.0,17.0,11.0,10.0,6.0,5.0,2.0,1.0,6.0,1.0,6.0,6.0,7.0,6.0,4.0,2.0,6.0,2.0,0.0,2.0,1.0,2.0,1.0,1.0,0.0,0.0,0.0,0.0,3.0,0.0,0.0,0.0,0.0,0.0,한미약품,345500,285000
51,한솔제지,24.07.31,I. 2Q24 Review & 투자전략,"전일(7/30) 발표한 2 분기 잠정실적(연결 기준)은 매출액 5,630 억원, 영업이익 51 억원으로 전년동기 대비 매출액은 6.6% 증가했으나, 영업이익은 64.8% 감소함. 시장 컨센서스(매출액 5,335억원, 영업이익 220억원) 대비 매출액은 소폭 상회하였지만, 영업이익은 크게 하회하였음. 제지 사업 부문(인쇄용지, 산업용지, 특수지 등) 매출 성장과 함께 영업이익은 약 505 억원이 발생했음에도 불구하고, 환경사업부문에서의 대손 및 해외사업장에서의 일시적인 비용 등으로 기타 사업 부문에서 454 억원의 비용이 발생하였기 때문임. ① 환경사업 부문의 대손은 부동산 경기침체 및 금융환경 악화로 기 발생한 공사 미수금을 회수하지 못하면서 지난해 말과 올해 2 분기에 대손처리한 것임. ② 또한, 국내 운영 사업장 소송 및 해외사업장 보증 건은 소송 및 가처분이 진행중이지만, 보수적인 관점에서 손실 처리한 것임. 일시적인 비용을 제외한다면, 2 분기의 영업이익은 500 억원대를 달성했을 것으로 추정함. 당사 추정 3 분기 예상실적(연결기준)은 매출액 5,462 억원, 영업이익 229 억원으로 전년동기 대비 각각 4.3%, 58.7% 증가할 것으로 예상함. 제지 사업 부문은 안정적인 실적이 유지될 것으로 예상하지만, 지난해 3 분기의 부진했던 실적 대비 기저효과로 영업이익은 크게 개선될 것으로 예상함. 특히 2분기에 크게 발생했던 환경사업 부문의 대손충당금은 약 100 억원 수준을 예상. 목표주가 14,000 원을 유지하며, 34.7% 상승여력을 보유, 투자의견 BUY 유지.",33.0,1.0,38.0,111.0,15.0,10.0,7.0,20.0,10.0,24.0,16.0,13.0,4.0,2.0,6.0,3.0,7.0,0.0,12.0,23.0,8.0,5.0,14.0,1.0,3.0,4.0,8.0,3.0,0.0,1.0,10.0,1.0,0.0,0.0,0.0,1.0,0.0,0.0,0.0,0.0,33.0,1.0,38.0,111.0,15.0,10.0,7.0,20.0,10.0,24.0,16.0,13.0,4.0,2.0,6.0,3.0,7.0,0.0,12.0,23.0,8.0,5.0,14.0,1.0,3.0,4.0,8.0,3.0,0.0,1.0,10.0,1.0,0.0,0.0,0.0,1.0,0.0,0.0,0.0,0.0,한솔제지,9420,8880
52,롯데정밀화학,24.07.31,"목표주가 7.0만원, 투자의견 매수 유지","동사에 대한 목표주가 7.0만원 및 투자의견 매수를 유지한다. 참고로 해당 목표주가는 24~25년 예상 BPS 101,085원에 PBR 0.7배를 적용해 산출된 값이다. 주요 투자 포인트는 ①그린소재가 더 이상 중장기 성장 동력원이 아니라, 동사 이익의 대부분을 차지하는 핵심 사업부로 확고하게 이미 자리 잡았고, ②염소계열 적자 규모도 점차 축소되고 있어 전체적인 실적 개선을 기대할 수 있으며, ③안정적인 이익 창출력 및 순현금의 재무구조, ④그리고 무엇보다 그럼에도 불구하고 PBR 역사적 최저 수준인 0.45배의 매력적인 밸류에이션 등으로 요약된다.",10.0,3.0,13.0,45.0,6.0,0.0,4.0,5.0,0.0,5.0,6.0,3.0,4.0,0.0,4.0,3.0,3.0,5.0,7.0,7.0,1.0,3.0,9.0,0.0,1.0,2.0,5.0,0.0,0.0,2.0,0.0,1.0,1.0,1.0,3.0,0.0,1.0,0.0,0.0,0.0,10.0,3.0,13.0,45.0,6.0,0.0,4.0,5.0,0.0,5.0,6.0,3.0,4.0,0.0,4.0,3.0,3.0,5.0,7.0,7.0,1.0,3.0,9.0,0.0,1.0,2.0,5.0,0.0,0.0,2.0,0.0,1.0,1.0,1.0,3.0,0.0,1.0,0.0,0.0,0.0,롯데정밀화학,46500,36900
55,삼성SDI,24.07.31,2Q24 실적 전지부문 부진으로 시장기대치 크게 하회,"동사의 2Q24 실적은 매출액 4.5조원(-24% YoY, -13% QoQ), 영업이익 2,802억원(-38% YoY, +5% QoQ)으로 낮아진 시장기대치(매출액 5.2조원, 영업이익 3,320억원)를 크게 하회했다. 전자재료부문이 선방했던 반면 북미, 유럽 전기차 수요의 뚜렷한 둔화세 영향으로 전지부문은 상당히 부진했다. 동사의 전기차향 배터리 매출의 약 70~80%를 차지하는 BMW와 Audi의 2Q24 전기차 합산 판매량은 전분기 대비 약 3% 성장에 그쳤으며, Rivian 판매량은 전분기 대비 약 14% 감소했다. 주력 완성차 OEM들의 배터리 셀 보유 재고량이 높다는 점도 부담으로 작용했다. 이로 인해 동사의 소형전지와 EV용 중대형 배터리 매출은 각각 전분기 대비 10%, 25% 가량 감소한 것으로 추정된다. 다만 원형전지 장기공급계약 기반 주문 미달 물량에 대한 보상금 수취 효과 약 1,400억원이 영업이익에 반영되면서 소형전지 영업이익률은 약 9%를 기록했지만 일회성이익 제외시 7년만에 적자전환 했다. ESS향 중대형전지는 전력용 배터리박스, 데이터센터용 UPS 공급 프로젝트 대응으로 매출액이 전분기 대비 약 20% 증가하면서 흑자전환 했다는 점은 긍정적 요인이다. 전자재료는 계절적 비수기로 인한 OLED 소재 출하 감소가 불가피했지만 스포츠 이벤트를 앞둔 편광필름의 성수기 진입과 메모리 반도체 업황 개선에 따른 수요 증가로 인해 양호한 실적을 기록했다.",24.0,14.0,55.0,78.0,10.0,9.0,12.0,11.0,3.0,11.0,12.0,10.0,9.0,3.0,5.0,2.0,8.0,7.0,7.0,13.0,11.0,1.0,13.0,0.0,13.0,5.0,1.0,4.0,0.0,2.0,0.0,2.0,1.0,1.0,8.0,1.0,0.0,0.0,0.0,0.0,24.0,14.0,55.0,78.0,10.0,9.0,12.0,11.0,3.0,11.0,12.0,10.0,9.0,3.0,5.0,2.0,8.0,7.0,7.0,13.0,11.0,1.0,13.0,0.0,13.0,5.0,1.0,4.0,0.0,2.0,0.0,2.0,1.0,1.0,8.0,1.0,0.0,0.0,0.0,0.0,삼성SDI,334500,262500
