,종목명,날짜,제목,본문,SN_caller,SL_caller,NNP_caller,NNG_caller,SF_caller,SS_caller,SW_caller,SP_caller,NR_caller,NNB_caller,JKB_caller,JX_caller,XSN_caller,JC_caller,JKO_caller,MAG_caller,JKG_caller,VV_caller,EC_caller,XSV_caller,EP_caller,MAJ_caller,ETM_caller,XPN_caller,MM_caller,JKS_caller,VCP_caller,VA_caller,NA_caller,XR_caller,ETN_caller,XSA_caller,SO_caller,NP_caller,EF_caller,VX_caller,VCN_caller,SH_caller,IC_caller,JKV_caller,SN_other,SL_other,NNP_other,NNG_other,SF_other,SS_other,SW_other,SP_other,NR_other,NNB_other,JKB_other,JX_other,XSN_other,JC_other,JKO_other,MAG_other,JKG_other,VV_other,EC_other,XSV_other,EP_other,MAJ_other,ETM_other,XPN_other,MM_other,JKS_other,VCP_other,VA_other,NA_other,XR_other,ETN_other,XSA_other,SO_other,NP_other,EF_other,VX_other,VCN_other,SH_other,IC_other,JKV_other,stock_name,price,price + 30days
1647,포스코인터내셔널,24.07.26,[컨퍼런스콜 Q&A],Q. 미얀마 가스전-2Q23 대비 2Q24 가스가격은 차이는 약 0.1달러이며 판매량도 큰 변화 없음- 실적이 좋았던 것은 3단계 개발 완료되며 Cost Recovery가 발생했기 때문- 매장량 재평가 결과가 예상을 상회(+0.9tcf)하며 감가비 연 500억원 축소 (2Q 120억원 반영),10.0,6.0,6.0,9.0,2.0,8.0,6.0,5.0,2.0,1.0,1.0,2.0,1.0,0.0,0.0,0.0,0.0,0.0,1.0,2.0,1.0,0.0,1.0,0.0,0.0,0.0,0.0,0.0,0.0,0.0,0.0,0.0,0.0,0.0,1.0,0.0,0.0,0.0,0.0,0.0,10.0,6.0,6.0,9.0,2.0,8.0,6.0,5.0,2.0,1.0,1.0,2.0,1.0,0.0,0.0,0.0,0.0,0.0,1.0,2.0,1.0,0.0,1.0,0.0,0.0,0.0,0.0,0.0,0.0,0.0,0.0,0.0,0.0,0.0,1.0,0.0,0.0,0.0,0.0,0.0,포스코인터내셔널,51400,47900
1652,LG전자,24.07.26,2Q24 Review: 가전은 역시 LG,"2Q24 영업이익 1조 1,961억원(+61.2% YoY)으로 컨센서스 대비 +18.8%를 상회하는 실적을 기록했다. H&A 사업부의 외형 성장과 VS 사업부의 믹스 마진 개선이 호실적을 견인했다고 판단한다. H&A는 신흥국 볼륨존 공략으로 탑라인 성장 및 구독의 비중 증가로 작년 대비 견조한 실적을 기록했다. VS는 전기차 수요 둔화에도 불구하고 고부가 제품 라인업 비중 증가로 믹스 마진을 개선했다. HE는 OLED TV의 스포츠 이벤트로 판매가 견조했으나, LCD 패널가 인상으로 수익성은 소폭 감소했고 BS는 외형 성장은 지속되나 신사업 진출 영향으로 적자는 지속되고 있는 상황이다.",18.0,2.0,18.0,41.0,8.0,8.0,3.0,9.0,4.0,7.0,8.0,6.0,2.0,1.0,2.0,1.0,1.0,1.0,2.0,7.0,6.0,1.0,2.0,0.0,3.0,4.0,0.0,0.0,0.0,1.0,0.0,1.0,0.0,0.0,5.0,0.0,0.0,0.0,0.0,0.0,18.0,2.0,18.0,41.0,8.0,8.0,3.0,9.0,4.0,7.0,8.0,6.0,2.0,1.0,2.0,1.0,1.0,1.0,2.0,7.0,6.0,1.0,2.0,0.0,3.0,4.0,0.0,0.0,0.0,1.0,0.0,1.0,0.0,0.0,5.0,0.0,0.0,0.0,0.0,0.0,LG전자,97200,90100
1661,포스코퓨처엠,24.07.26,2Q24 Review: 역대 최고 마진율을 기록한 서프라이즈,"포스코인터내셔널의 2Q24 매출액은 8조 2,823억원으로 감소세를(6.6% YoY) 이어갔다. 철강(-26% YoY) 및 친환경 소재(-9% YoY)의 매출액 낙폭이 커진 가운데, 에너지 내 미얀마 가스전(13% YoY), 발전(5% YoY) 등이 낙폭을 축소했다. 미얀마 가스전은 3단계 개발에 따른 판매량 증가(7.4% YoY)가 주효했다. 발전 역시 SMP 하락에도 불구하고, 이용율 개선(44.8%, +11%p YoY)을 시현하며 성장했다. 영업이익은 3,497억원(-2.1% YoY, OPM 4.2%)를 기록했다. 전년비 감소세를 이어갔으나 그 폭이 축소되며 시장 기대치(2,792억원)를 크게 상회했다. 영업이익률 4.2%는 역대 최고 수준의 마진이다. 미얀마 가스전에서의 영업이익이 1,376억원(25% YoY)으로 역대 최고치(직전 최고치 2Q19 1,243억원)를 기록했다. 일시적인 코스트리커버리 효과를 감안해도 고무적이다. 반면, 철강(432억원, -43% YoY) 및 친환경(329억원, -29% YoY)은 시황 부진과 기저효과로 인해 크게 하락했다.",37.0,11.0,36.0,51.0,19.0,14.0,17.0,14.0,12.0,14.0,10.0,10.0,3.0,2.0,3.0,2.0,1.0,8.0,4.0,8.0,6.0,1.0,8.0,2.0,2.0,2.0,3.0,2.0,2.0,1.0,0.0,1.0,0.0,0.0,10.0,0.0,0.0,0.0,0.0,0.0,37.0,11.0,36.0,51.0,19.0,14.0,17.0,14.0,12.0,14.0,10.0,10.0,3.0,2.0,3.0,2.0,1.0,8.0,4.0,8.0,6.0,1.0,8.0,2.0,2.0,2.0,3.0,2.0,2.0,1.0,0.0,1.0,0.0,0.0,10.0,0.0,0.0,0.0,0.0,0.0,포스코퓨처엠,233500,172400
1669,삼성에스디에스,24.07.26,"매출 예상 부합, 이익은 예상 상회","2Q 매출은 3.37조원(+2.4% YoY)을 기록하며 예상치에 부합했다. 클라우드와 물류가 예상을 상회하는 실적을 발표하면서 SI 부진을 상쇄했다. 이익성이 개선되고 있다. IT서비스에서 기존 저마진의 SI 매출을, 상대적 고마진의 클라우드가 대체하면서 영업이익률 개선세가 이어지고 있다. 영업이익은 2,209억원(+7.1% YoY)으로 시장 추정치를 1% 상회했다. IT서비스 OPM은 12.5%로 +1.6%pt QoQ로 늘었다. IT 서비스 매출은 역시나 클라우드가 주도했다. SI 매출은 2,678억원(-7.3% YoY)으로 역성장을 이어갔으나, 이를 대체하는 클라우드 사업부가 5,560억원(+25.1% YoY)의 호실적을 기록했다. 특히 클라우드에서 CSP는 YoY 50% 증가해 2,100억원을 기록했다. GPU의 클라우드 서비스 수요가 급증했다, SaaS도 +31.9%로 성장한 984억원을 기록하며 고성장을 이어갔다. SCM, HR 등 솔루션 수요가 지속되고 있다. 비수기인 탓에, 생성AI 신규 매출 인식이 하반기와 내년으로 몰릴 것으로 예상되면서 MSP 매출 증가율은 8.3% YoY에 그쳤다. 물류 매출은 1.78조원(+0.1% YoY)으로 최근 해운과 항공 모두 운임 상승세가 이어지며 예상을 상회했다.",8.0,6.0,10.0,41.0,6.0,7.0,3.0,5.0,2.0,5.0,4.0,5.0,1.0,2.0,1.0,1.0,3.0,1.0,5.0,10.0,6.0,0.0,5.0,0.0,2.0,6.0,1.0,2.0,0.0,1.0,1.0,0.0,0.0,0.0,6.0,2.0,0.0,0.0,0.0,0.0,8.0,6.0,10.0,41.0,6.0,7.0,3.0,5.0,2.0,5.0,4.0,5.0,1.0,2.0,1.0,1.0,3.0,1.0,5.0,10.0,6.0,0.0,5.0,0.0,2.0,6.0,1.0,2.0,0.0,1.0,1.0,0.0,0.0,0.0,6.0,2.0,0.0,0.0,0.0,0.0,삼성에스디에스,148400,148300
1675,포스코인터내셔널,24.07.26,2Q24 Review: 역대 최고 마진율을 기록한 서프라이즈,"포스코인터내셔널의 2Q24 매출액은 8조 2,823억원으로 감소세를(6.6% YoY) 이어갔다. 철강(-26% YoY) 및 친환경 소재(-9% YoY)의 매출액 낙폭이 커진 가운데, 에너지 내 미얀마 가스전(13% YoY), 발전(5% YoY) 등이 낙폭을 축소했다. 미얀마 가스전은 3단계 개발에 따른 판매량 증가(7.4% YoY)가 주효했다. 발전 역시 SMP 하락에도 불구하고, 이용율 개선(44.8%, +11%p YoY)을 시현하며 성장했다. 영업이익은 3,497억원(-2.1% YoY, OPM 4.2%)를 기록했다. 전년비 감소세를 이어갔으나 그 폭이 축소되며 시장 기대치(2,792억원)를 크게 상회했다. 영업이익률 4.2%는 역대 최고 수준의 마진이다. 미얀마 가스전에서의 영업이익이 1,376억원(25% YoY)으로 역대 최고치(직전 최고치 2Q19 1,243억원)를 기록했다. 일시적인 코스트리커버리 효과를 감안해도 고무적이다. 반면, 철강(432억원, -43% YoY) 및 친환경(329억원, -29% YoY)은 시황 부진과 기저효과로 인해 크게 하락했다.",23.0,11.0,39.0,72.0,10.0,12.0,6.0,11.0,6.0,12.0,8.0,7.0,5.0,1.0,9.0,5.0,3.0,8.0,7.0,12.0,7.0,11.0,10.0,1.0,0.0,3.0,3.0,0.0,0.0,0.0,0.0,0.0,0.0,0.0,6.0,0.0,0.0,0.0,0.0,0.0,23.0,11.0,39.0,72.0,10.0,12.0,6.0,11.0,6.0,12.0,8.0,7.0,5.0,1.0,9.0,5.0,3.0,8.0,7.0,12.0,7.0,11.0,10.0,1.0,0.0,3.0,3.0,0.0,0.0,0.0,0.0,0.0,0.0,0.0,6.0,0.0,0.0,0.0,0.0,0.0,포스코인터내셔널,51400,47900
1680,LX하우시스,24.07.26,2Q24 Review: 영업이익은 시장 예상치 8% 하회,"2024년 2분기, LX하우시스 연결 실적은 매출액 9,419억원(+0.4%, YoY), 영업이익 378억원(-23.5%, YoY)으로 영업이익은 시장 예상치(412억원, 3개월 기준)를 8% 하회했다. 건자재 부문은 미국 주택 거래 둔화에 따른 이스톤 매출 감소와 Mix 악화 요인이 반영됐다. 원재료인 MMA 가격 상승과 마케팅 비용 증가는 건자재 부문 손익에 부정적 요인으로 작용했다. 반면, 자동차소재/필름 부문은 자동차향 실적 증가와 가전필름의 적용 모델 확대로 뚜렷한 이익 개선을 시현했다. 원/달러 강세에 따른 환율 효과 역시 수출 비중이 높은 필름 사업부 손익에 긍정적 요인으로 반영되었다.",15.0,9.0,19.0,36.0,9.0,0.0,0.0,12.0,0.0,9.0,6.0,1.0,2.0,0.0,8.0,2.0,1.0,4.0,8.0,9.0,1.0,1.0,5.0,2.0,0.0,2.0,1.0,3.0,0.0,1.0,0.0,0.0,0.0,0.0,5.0,1.0,0.0,0.0,0.0,0.0,15.0,9.0,19.0,36.0,9.0,0.0,0.0,12.0,0.0,9.0,6.0,1.0,2.0,0.0,8.0,2.0,1.0,4.0,8.0,9.0,1.0,1.0,5.0,2.0,0.0,2.0,1.0,3.0,0.0,1.0,0.0,0.0,0.0,0.0,5.0,1.0,0.0,0.0,0.0,0.0,LX하우시스,42000,35100
1682,삼성E&A,24.07.26,2Q24 Review: 영업이익은 시장 예상치 30% 상회,"2024년 2분기, 삼성E&A 실적은 매출액 2.69조원(-3.6%, YoY), 영업이익 2,626억원(-23.8%, YoY)으로 컨센서스(영업이익 2,019억원, 1개월 기준)를 30% 상회하는 어닝 서프라이즈를 기록했다. 전년동기 대비 영업이익 감소는 2023년 2분기 정산이익에 기인한 역대 분기 최대 실적의 기저 효과에 기인한다. 당분기 화공 부문은 종료 단계의 물가 보상, 정산에 따른 일회성 손익으로 약 1,250억원 규모의 매출 증가 효과가 반영되었다. 다만, 비화공 원가율은 Cost+Fee 현장 매출 비중 증가로 다소 높아졌다. 판관비율은 인력 증가 및 D/T 사용료 반영으로 전분기에 이어 5%대를 기록했다. 태국 법인(지분 49.99%)이 수행하는 TOP 프로젝트 대규모 비용 선반영으로 지배주주순이익은 크게 증가했다(비지배주주순이익 -1,011억원)",19.0,15.0,30.0,50.0,12.0,5.0,11.0,8.0,2.0,10.0,9.0,7.0,3.0,1.0,3.0,1.0,2.0,3.0,7.0,14.0,8.0,1.0,9.0,0.0,1.0,1.0,0.0,0.0,0.0,3.0,0.0,3.0,0.0,0.0,7.0,0.0,0.0,0.0,0.0,0.0,19.0,15.0,30.0,50.0,12.0,5.0,11.0,8.0,2.0,10.0,9.0,7.0,3.0,1.0,3.0,1.0,2.0,3.0,7.0,14.0,8.0,1.0,9.0,0.0,1.0,1.0,0.0,0.0,0.0,3.0,0.0,3.0,0.0,0.0,7.0,0.0,0.0,0.0,0.0,0.0,삼성E&A,20100,17710
1691,우리금융지주,24.07.26,"투자의견 Trading Buy, 목표주가 17,000원 유지","우리금융지주 2분기 지배주주순이익은 9,314억원으로, 당사 추정치 7,364억원과 컨센서스 7,864억원 상회. 당사 추정치를 상회한 이유는 1) 유가증권 매매평가익 급등으로 비이자이익이 추정치를 상회했고, 2) 대손비용이 예상보다 적었기 때문. 이자이익은 추정치에 부합했으며, 은행 순이자마진은 전분기대비 3bps 하락. 이에 더불어 동사는 기업가치제고계획을 발표했는데, 1) 중장기 ROE 목표 10%, 2) CET1비율 구간에 따른 주주환원율 목표치, 3) M&A 전략 등을 제시. 다만 자본비용이나 자본의 효율적인 배치에 대한 내용이 없는 점은 아쉽다고 판단. 목표 주주환원율로는 1) CET1비율이 11.5~12.5%일 때는 최대 35%, 2) CET1비율이 12.5~13.0%일 때는 최대 45%, 3) CET1비율이 13.0%를 초과할 때는 최대 50%를 제시했으며, 주주환원율 40% 미만에서는 현금 배당성향 30%를 유지하면서 초과분에 대해서는 자사주 매입·소각을 진행할 계획. 경영진은 연중 CET1비율 12.2% 달성을 목표하고 있지만, 이를 위해서는 환율 안정이 필요할 전망. 한편 경영진은 컨퍼런스콜에서 보험사 인수 시 염가매수차익을 인식할 경우 증자 없이도 자본비율을 방어하면서 연결 ROE가 개선될 것이라는 기대를 표명. 다만 1) 아직 실사가 진행 중이라는 점과 2) 염가매수차익이 발생하지 않을 경우 자본비율이 훼손되는 것은 맞다는 점에서 불확실성이 남아있다고 판단. 당사는 현재 동사가 계획하는 자본비율 개선과 주주환원 확대, 그리고 비은행 자회사 포트폴리오 확장이 동시에 성공하기 위해서는 여러 가정과 희망사항이 포함되어야 한다고 판단. 이 모든 것이 성공할 경우 분명 가치 제고에 도움이 될 것으로 예상하지만 당장 성공을 단언하기는 어렵다고 판단.",0.0,1.0,0.0,0.0,0.0,0.0,0.0,0.0,0.0,0.0,0.0,0.0,0.0,0.0,0.0,0.0,0.0,0.0,0.0,0.0,0.0,0.0,0.0,0.0,0.0,0.0,0.0,0.0,0.0,0.0,0.0,0.0,0.0,0.0,0.0,0.0,0.0,0.0,0.0,0.0,0.0,1.0,0.0,0.0,0.0,0.0,0.0,0.0,0.0,0.0,0.0,0.0,0.0,0.0,0.0,0.0,0.0,0.0,0.0,0.0,0.0,0.0,0.0,0.0,0.0,0.0,0.0,0.0,0.0,0.0,0.0,0.0,0.0,0.0,0.0,0.0,0.0,0.0,0.0,0.0,우리금융지주,16440,16190
1699,SK하이닉스,24.07.26,"투자의견 매수(BUY), 목표주가 265,000원 유지","목표주가는 25년 BPS(129,363원)에 Target P/B 2.1배를 적용하여 산출, 투자의견 매수 유지. 2Q24 매출액 16.42조원(YoY +125%), 영업이익 5.47조원(YoY 흑자전환)을 기록. 영업이익은 당사 추정치와 컨센서스를 상회, 매출액은 최고치를 달성함. 2Q24 DRAM 영업이익은 4.6조원(OPM 43%)로 추정. 주요 고객사향 8단 HBM3E 공급 효과 및 DRAM ASP 상승으로 전분기대비 이익률이 12%p 상승. 2분기 NAND 영업이익은 0.8조원으로 예상, 고용량 eSSD 매출 비중 확대 및 공급재고평가 손실 충당금 환입이 일부 반영되며 이익 개선 2Q24 DRAM, NAND Bit Growth는 각각 +22% QoQ, -3% QoQ 추정, ASP는 DRAM +15% QoQ, NAND +18% QoQ로 판단. 2분기 재고평가손실 충당금 환입 규모는 3천억원 수준",43.0,7.0,44.0,140.0,23.0,6.0,15.0,19.0,5.0,18.0,20.0,18.0,11.0,2.0,13.0,5.0,5.0,18.0,26.0,24.0,13.0,1.0,16.0,1.0,3.0,11.0,7.0,7.0,0.0,4.0,15.0,1.0,1.0,0.0,0.0,0.0,0.0,0.0,0.0,0.0,43.0,7.0,44.0,140.0,23.0,6.0,15.0,19.0,5.0,18.0,20.0,18.0,11.0,2.0,13.0,5.0,5.0,18.0,26.0,24.0,13.0,1.0,16.0,1.0,3.0,11.0,7.0,7.0,0.0,4.0,15.0,1.0,1.0,0.0,0.0,0.0,0.0,0.0,0.0,0.0,SK하이닉스,190900,171700
1712,한화솔루션,24.07.26,"투자의견 매수, 목표주가 40,000원 유지",목표주가는 SOTP 방식으로 산출. 신재생에너지 부문 Target EV/EBITDA 9.5배 적용. 25년 1월 카터스빌 공장 셀 생산에 따른 DCA요건 충족으로 멀티플 상향,30.0,17.0,12.0,46.0,10.0,12.0,23.0,10.0,4.0,11.0,7.0,5.0,7.0,1.0,6.0,1.0,4.0,2.0,4.0,9.0,3.0,1.0,6.0,0.0,1.0,5.0,1.0,1.0,0.0,2.0,1.0,2.0,0.0,0.0,4.0,0.0,0.0,0.0,0.0,0.0,30.0,17.0,12.0,46.0,10.0,12.0,23.0,10.0,4.0,11.0,7.0,5.0,7.0,1.0,6.0,1.0,4.0,2.0,4.0,9.0,3.0,1.0,6.0,0.0,1.0,5.0,1.0,1.0,0.0,2.0,1.0,2.0,0.0,0.0,4.0,0.0,0.0,0.0,0.0,0.0,한화솔루션,21350,17600
1720,POSCO홀딩스,24.07.26,"투자의견 매수, 목표주가 520,000원 유지","목표주가는 SOTP 방식으로 산출. 영업 및 지분가치 52.5조원(철강 23.8조원, 친환경인프라 7.3조원, 친환경소재 21.4조원)과‘23년 기말 순차입금 8.9조원을 감안한 NAV를 43.6조원으로 산정. 연말까지의 예정 자사주 소각(194.7만주)을 반영",43.0,12.0,34.0,41.0,16.0,21.0,20.0,17.0,11.0,10.0,6.0,5.0,2.0,1.0,6.0,1.0,6.0,6.0,7.0,6.0,4.0,2.0,6.0,2.0,0.0,2.0,1.0,2.0,1.0,1.0,0.0,0.0,0.0,0.0,3.0,0.0,0.0,0.0,0.0,0.0,43.0,12.0,34.0,41.0,16.0,21.0,20.0,17.0,11.0,10.0,6.0,5.0,2.0,1.0,6.0,1.0,6.0,6.0,7.0,6.0,4.0,2.0,6.0,2.0,0.0,2.0,1.0,2.0,1.0,1.0,0.0,0.0,0.0,0.0,3.0,0.0,0.0,0.0,0.0,0.0,POSCO홀딩스,343500,290000
1726,현대글로비스,24.07.26,"투자의견 매수, 목표주가 160,000원으로 3.2% 상향","목표주가는 2025년 추정 EPS에 Target PBR 7.0배를 적용. 목표주가 변경은 100% 무상증자에 따른 주식수 증가와 2분기 실적이 당사 추정을 상회함에 따른 추정치 상향에 근거 현대글로비스의 2024년 2분기 영업이익은 당사 및 시장의 기대치를 약 4.4% 상회. 부문별로 볼 때, 해운 부문은 기대를 다소 하회했지만, 물류와 CKD부문의 수익성 개선으로 예상을 상회하는 실적을 시현. 특히 CKD부문의 경우 원/달러환율 상승에 따라 약 200억원 수준의 영업이익 개선효과가 발생한 것으로 추정함 해운사업부문의 2분기 영업이익률은 6.1%로 1분기의 7.2% 대비 하락. 이유는 1)1분기 항만 체선 비용 정산이익 반영에 따른 기저효과, 2)PCC 단기 비용 증가, 3)계열매출비중 상승에 따른 영향으로 판단 하반기 중장기 용선 확대에 따른 Capacity증가로 단기용선반선, 비계열 물량의 증가로 해운사업부문 수익성 개선 전망하며, CKD부문도 외형성장기조가 이어질 것으로 기대",33.0,1.0,38.0,111.0,15.0,10.0,7.0,20.0,10.0,24.0,16.0,13.0,4.0,2.0,6.0,3.0,7.0,0.0,12.0,23.0,8.0,5.0,14.0,1.0,3.0,4.0,8.0,3.0,0.0,1.0,10.0,1.0,0.0,0.0,0.0,1.0,0.0,0.0,0.0,0.0,33.0,1.0,38.0,111.0,15.0,10.0,7.0,20.0,10.0,24.0,16.0,13.0,4.0,2.0,6.0,3.0,7.0,0.0,12.0,23.0,8.0,5.0,14.0,1.0,3.0,4.0,8.0,3.0,0.0,1.0,10.0,1.0,0.0,0.0,0.0,1.0,0.0,0.0,0.0,0.0,현대글로비스,121200,118700
1729,현대차,24.07.26,"투자의견 매수, 목표주가 400,000원 유지","TP는 2024~25년 EPS 51,630원에 Target PER 7.6배(고수익성 지속됐던 2011~12년 차화정 당시 PER) 적용. 현대차 주가는 1H24 +45% 상승한 이후, 7월 -15% 하락. 1) 높아졌던 실적 기대감 조정, 2) 2H24 업황 우려 때문이라 판단. 하지만, 1) 양호한 2Q24 실적, 2) 2H24 이벤트 모멘텀(CID/인도 IPO) 기대 재차 반영되며 주가 반등 예상. 2H24 자동차 업종 수요 둔화와 경쟁심화 가능성 경계할 필요 있으나, 1) 이벤트 모멘텀 기대감 반영, 2) 여전히 저렴한 밸류에이션 감안 시 매수 관점에서 접근할 필요",10.0,3.0,13.0,45.0,6.0,0.0,4.0,5.0,0.0,5.0,6.0,3.0,4.0,0.0,4.0,3.0,3.0,5.0,7.0,7.0,1.0,3.0,9.0,0.0,1.0,2.0,5.0,0.0,0.0,2.0,0.0,1.0,1.0,1.0,3.0,0.0,1.0,0.0,0.0,0.0,10.0,3.0,13.0,45.0,6.0,0.0,4.0,5.0,0.0,5.0,6.0,3.0,4.0,0.0,4.0,3.0,3.0,5.0,7.0,7.0,1.0,3.0,9.0,0.0,1.0,2.0,5.0,0.0,0.0,2.0,0.0,1.0,1.0,1.0,3.0,0.0,1.0,0.0,0.0,0.0,현대차,237000,217000
1741,LG전자,24.07.26,"투자의견 매수(BUY) 및 목표주가 140,000원 유지","2024년 주당순자산(BPS)에 목표P/B 1.15배(실적회복기에 평균) 적용하여 목표주가 140,000원 및 투자의견 매수(BUY) 유지. 2Q 컨센서스 상회 및 불확실한 환경에서 양호한 실적으로 평가. 구독사업/B2B 영역으로 포트폴리오 전환 등 긍정적으로 평가, 2024년 P/E 8.4배(P/B 0.9배) 저평가, 중장기 관점에서 비중확대 유지 2024년 2Q 전체(연결) 매출은 21.7조원(8.5% yoy/2.8% qoq)/영업이익은 1.196조원(61.2% yoy/-10.4% qoq) 시현. 볼륨존 및 구독 관련한 매출 증가로 가전(H&A) 매출(8.8조원)은 10.6%(yoy) 증가, 영업이익률은 7.9%로 0.4%p(yoy) 확대, 다만 종전 추정을 하회, TV(HE)는 OLED TV 중심으로 유럽형 매출 확대, 믹스 효과(webOS)로 영업이익률(2.7%)은 종전 추정을 상회. VS(전장) 부문은 믹스 개선으로 영업이익률은 3%로 종전 추정을 상회, 1%p(qoq) 개선",24.0,14.0,55.0,78.0,10.0,9.0,12.0,11.0,3.0,11.0,12.0,10.0,9.0,3.0,5.0,2.0,8.0,7.0,7.0,13.0,11.0,1.0,13.0,0.0,13.0,5.0,1.0,4.0,0.0,2.0,0.0,2.0,1.0,1.0,8.0,1.0,0.0,0.0,0.0,0.0,24.0,14.0,55.0,78.0,10.0,9.0,12.0,11.0,3.0,11.0,12.0,10.0,9.0,3.0,5.0,2.0,8.0,7.0,7.0,13.0,11.0,1.0,13.0,0.0,13.0,5.0,1.0,4.0,0.0,2.0,0.0,2.0,1.0,1.0,8.0,1.0,0.0,0.0,0.0,0.0,LG전자,97200,90100
1750,현대제철,24.07.26,"투자의견 매수, 목표주가 36,000원 유지","목표주가는 2024E BPS 143,496원에 타깃 PBR 0.25배를 적용. 타깃 PBR은 과거 업황 바닥기였던 2019~2020년 평균 PBR 수준",1.0,4.0,18.0,26.0,2.0,5.0,0.0,5.0,1.0,2.0,3.0,2.0,2.0,2.0,1.0,0.0,0.0,2.0,2.0,2.0,2.0,0.0,3.0,1.0,0.0,0.0,1.0,0.0,3.0,0.0,0.0,0.0,0.0,0.0,0.0,0.0,0.0,0.0,0.0,0.0,1.0,4.0,18.0,26.0,2.0,5.0,0.0,5.0,1.0,2.0,3.0,2.0,2.0,2.0,1.0,0.0,0.0,2.0,2.0,2.0,2.0,0.0,3.0,1.0,0.0,0.0,1.0,0.0,3.0,0.0,0.0,0.0,0.0,0.0,0.0,0.0,0.0,0.0,0.0,0.0,현대제철,26700,21500
1753,HD현대,24.07.26,"투자의견 매수, 목표주가 100,000원 유지","HD현대의 2024년 2분기 실적은 당사 및 시장의 기대를 크게 상회하는 깜짝 실적을 시현함. 유가 및 정유 시황 하락에 따라 오일뱅크의 실적이 기대를 하회했음에도 불구하고, 현대중공업과 미포조선을 포함한 조선부문과 현대일렉트릭, 그리고 마린솔루션의 실적이 호조를 기록했기 때문임 실적발표와 함께 주당 900원의 분기배당을 실시함. 동사의 수취 배당금의 상당부분을 담당하고 있는 오일뱅크의 실적부진에도 불구하고 분기배당 및 기말 배당의 감소 가능성은 희박할 것으로 판단함 2분기 깜짝 실적을 이끌었던 조선과 마린솔루션, 그리고 일렉트릭의 하반기 실적 전망도 밝은 상황으로 HD현대의 2024년 하반기 실적도 개선세를 이어갈 것으로 전망함. 밸류업 정책과 관련해서는 정부의 세제혜택방안이 구체화된 이후 보유중인 자사주 소각을 포함한 주주환원확대에 대해 검토할 것으로 예상",41.0,17.0,20.0,54.0,22.0,14.0,31.0,17.0,2.0,3.0,6.0,12.0,3.0,3.0,8.0,1.0,3.0,5.0,10.0,10.0,9.0,1.0,6.0,3.0,0.0,2.0,4.0,2.0,0.0,1.0,1.0,1.0,0.0,0.0,7.0,1.0,0.0,0.0,0.0,0.0,41.0,17.0,20.0,54.0,22.0,14.0,31.0,17.0,2.0,3.0,6.0,12.0,3.0,3.0,8.0,1.0,3.0,5.0,10.0,10.0,9.0,1.0,6.0,3.0,0.0,2.0,4.0,2.0,0.0,1.0,1.0,1.0,0.0,0.0,7.0,1.0,0.0,0.0,0.0,0.0,HD현대,78500,77100
1754,NH투자증권,24.07.26,"투자의견 매수, 목표주가 16,000원 유지","NH투자증권 2분기 지배주주순이익은 1,972억원으로, 당사 추정치 1,934억원과 컨센서스 1,899억원에 부합했다. 다만 증권 별도 순이익은 1,547억원으로, 당사 추정치 1,780억원을 하회했다. 이는 1) 연결 대상인 비시장성 자산 평가 결과는 예상보다 양호했지만 2) 증권 별도로는 대손비용과 판관비가 추정치를 상회했기 때문으로 판단한다. 순수수료이익은 연결 기준 전년동기대비 9.0%, 전분기대비 4.4% 감소, 별도 기준 전년동기대비 7.1%, 전분기대비 6.1% 감소하며 추정치에 부합했다. 위탁매매, 자산관리, IB 모두 예상 수준에 부합하는 양호한 모습을 보였다. 다만 위탁매매 수수료율이 다시 하락세를 보이는 점은 우려 요인이다. 이자손익은 연결 기준 전년동기대비 1.0% 증가, 전분기대비 0.1% 감소, 별도 기준 전년동기대비 0.6% 감소, 전분기대비 0.4% 증가하며 추정치에 부합했다. 금리 하락으로 이자비용률은 개선되었으나 대손 상각으로 인한 대출채권 감소로 순이자마진은 전분기대비 하락했다. 트레이딩 및 상품손익은 연결 978억원, 별도 731억원 흑자를 기록하며 추정치를 상회했다. 별도 기준으로도 금리 하락에 따라 금융상품 평가손익이 개선된 점에 더불어 연결 대상 비시장성 자산 평가도 양호했던 것으로 판단한다. 기타손익은 연결 369억원, 별도 421억원 흑자를 기록하며 추정치를 하회했다. 주로 대손비용 증가에 기인한며, 이는 PF 사업장 재평가에 따라 발생한 것으로 추정한다. 그럼에도 절대 규모가 크지 않다는 점에서 동사의 PF 관련 우려는 여전히 제한적이라고 판단한다. 판관비는 연결 기준 전년동기대비 19.0%, 전분기대비 12.1% 증가, 별도 기준 전년동기대비 21.5%, 전분기대비 13.6% 증가하며 추정치를 상회했다. 이에 따라 경비율도 연결 52.3%, 별도 53.2%를 기록하며 추정치(연결 47.2%, 별도 47.0%)를 상회했다.",0.0,0.0,6.0,12.0,1.0,0.0,0.0,2.0,0.0,1.0,1.0,0.0,0.0,0.0,0.0,1.0,1.0,0.0,0.0,0.0,0.0,0.0,0.0,0.0,0.0,1.0,0.0,1.0,1.0,0.0,1.0,0.0,0.0,0.0,0.0,0.0,0.0,0.0,0.0,0.0,0.0,0.0,6.0,12.0,1.0,0.0,0.0,2.0,0.0,1.0,1.0,0.0,0.0,0.0,0.0,1.0,1.0,0.0,0.0,0.0,0.0,0.0,0.0,0.0,0.0,1.0,0.0,1.0,1.0,0.0,1.0,0.0,0.0,0.0,0.0,0.0,0.0,0.0,0.0,0.0,NH투자증권,13830,13370
1758,한화솔루션,24.07.26,목표주가 3.5만원으로 하향. 매수 의견 유지,"한화솔루션의 목표주가를 10.3% 하향 조정한 3.5만원으로 제시하며, 매수 의견은 유지한다. 목표주가를 하향한 이유는 1) 예상보다 더딘 모듈 수익성 개선, 2) 차입금 증가 속도에 맞춰 순차입금 전망치를 높였기 때문이다. 하지만 모듈 및 기타 사업에서 초기 비용 부담을 주고 있는 신규 사업들이 점차 궤도에 올라서고, EPC의 탑라인과 수익성이 개선되면서 보다 빠른 실적 개선세를 전망한다. 해상 운임이 꺾이기 시작한 점도 추가 호재로 판단한다. 매수 의견을 유지한다.",0.0,1.0,11.0,30.0,2.0,2.0,0.0,2.0,0.0,4.0,4.0,0.0,5.0,1.0,0.0,0.0,1.0,7.0,6.0,3.0,1.0,0.0,5.0,1.0,0.0,1.0,1.0,0.0,0.0,0.0,0.0,0.0,0.0,0.0,0.0,0.0,0.0,0.0,0.0,0.0,0.0,1.0,11.0,30.0,2.0,2.0,0.0,2.0,0.0,4.0,4.0,0.0,5.0,1.0,0.0,0.0,1.0,7.0,6.0,3.0,1.0,0.0,5.0,1.0,0.0,1.0,1.0,0.0,0.0,0.0,0.0,0.0,0.0,0.0,0.0,0.0,0.0,0.0,0.0,0.0,한화솔루션,21350,17600
1766,LG에너지솔루션,24.07.26,[컨퍼런스콜 Q&A],Q. 수요전망- 기존 예상 대비 둔화 추세인 것은 사실-3Q~하반기는 메탈가 하락에 따른 판가 영향 다소 줄어들 것- 북미 시장 EV 신모델 출시 계획되어 있어 대응하는 수요 일부 있을 것- 북미 전력망 프로젝트 관련 매출확대 기회가 상당히 커질 것이라 전망해 준비 중- 메탈가 하락 영향 소멸과 매출확대에 따른 단위당 고정비 부담 절감 기대- IRA 제외해도 영업이익 흑자 달성 가능할 듯,17.0,8.0,33.0,67.0,12.0,5.0,5.0,9.0,8.0,17.0,15.0,4.0,9.0,5.0,5.0,4.0,4.0,7.0,7.0,15.0,4.0,3.0,12.0,2.0,4.0,11.0,3.0,2.0,2.0,0.0,0.0,0.0,0.0,0.0,9.0,1.0,0.0,0.0,0.0,0.0,17.0,8.0,33.0,67.0,12.0,5.0,5.0,9.0,8.0,17.0,15.0,4.0,9.0,5.0,5.0,4.0,4.0,7.0,7.0,15.0,4.0,3.0,12.0,2.0,4.0,11.0,3.0,2.0,2.0,0.0,0.0,0.0,0.0,0.0,9.0,1.0,0.0,0.0,0.0,0.0,LG에너지솔루션,389500,383500
